ids,text,aspect,sentiment,entity,attribute
B00KMRGF28_225_A3HI5ZE8DCIM5S:3,price great everyth want thank,LAPTOP#GENERAL,positive,LAPTOP,GENERAL
328:1,listen music watch video eas great display,LAPTOP#USABILITY,positive,LAPTOP,USABILITY
8:0,comput repair twice first month purchas,LAPTOP#QUALITY,negative,LAPTOP,QUALITY
160:2,friend report notebook astonish perform pictur qualiti eas use,LAPTOP#OPERATION_PERFORMANCE,positive,LAPTOP,OPERATION_PERFORMANCE
B00KMRGF28_109_A1EUFUJPPD4V05:1,loud clunki figur get use,MOUSE#QUALITY,negative,MOUSE,QUALITY
81:0,good keyboard long batteri life large hard drive window,BATTERY#OPERATION_PERFORMANCE,positive,BATTERY,OPERATION_PERFORMANCE
5:0,laptop lightweight easili carri around knapsack full text book bare add weight,LAPTOP#DESIGN_FEATURES,positive,LAPTOP,DESIGN_FEATURES
B00KB3MXH4_22_A106YGESUYA4BP:7,still explor variou featur overal satisfi purchas,LAPTOP#DESIGN_FEATURES,neutral,LAPTOP,DESIGN_FEATURES
284:1,glad buy great netbook low price,LAPTOP#PRICE,positive,LAPTOP,PRICE
B00KMRGF28_187_A13MKZMIR0KM7W:5,tini forgiv drawback ethernet cabl outlet,LAPTOP#DESIGN_FEATURES,neutral,LAPTOP,DESIGN_FEATURES
1:0,say w w,LAPTOP#GENERAL,positive,LAPTOP,GENERAL
B00FU83YWS_35_A2OBBREWRCQJX:1,big screen expect laptop desktop design realli nice use type usag includ program edit,DISPLAY#DESIGN_FEATURES,positive,DISPLAY,DESIGN_FEATURES
49:5,laptop cost approxim die year month day use,LAPTOP#QUALITY,negative,LAPTOP,QUALITY
73:2,reinstal standard os cd proprietari hardwar driver,SOFTWARE#GENERAL,negative,SOFTWARE,GENERAL
230:4,pay laptop bell whistl keep crap,LAPTOP#QUALITY,negative,LAPTOP,QUALITY
B00KMRGF28_128_A1BJWKIOJWBL7N:4,fix think would nice cost effect laptop,LAPTOP#PRICE,positive,LAPTOP,PRICE
B00KMRGF28_193_A20GPA6RDO8DT7:3,first thing say posit laptop light make realli portabl rel clear screen bonu,DISPLAY#QUALITY,positive,DISPLAY,QUALITY
104:12,imposs get back,LAPTOP#QUALITY,negative,LAPTOP,QUALITY
259:7,good world power eas mac,LAPTOP#GENERAL,positive,LAPTOP,GENERAL
321:0,problem lack screen resolut,LAPTOP#GENERAL,positive,LAPTOP,GENERAL
294:4,one thing wish detail hardcopi manuel,LAPTOP#MISCELLANEOUS,negative,LAPTOP,MISCELLANEOUS
394:14,seriou game laptop seriou medium machin,LAPTOP#MISCELLANEOUS,negative,LAPTOP,MISCELLANEOUS
387:1,downfal volum control,MULTIMEDIA_DEVICES#OPERATION_PERFORMANCE,negative,MULTIMEDIA_DEVICES,OPERATION_PERFORMANCE
393:6,ts nice high end laptop fit budget featur need,LAPTOP#PRICE,positive,LAPTOP,PRICE
254:0,would recommend comput anyon search perfect laptop batteri life amaz,LAPTOP#GENERAL,positive,LAPTOP,GENERAL
351:3,cord come right power plu cord come front headphon mic plu network connect leave make messi setup cord go everi direct,LAPTOP#DESIGN_FEATURES,negative,LAPTOP,DESIGN_FEATURES
346:4,overal comput easi use screen perfect great comput daughter love,LAPTOP#USABILITY,positive,LAPTOP,USABILITY
269:4,get use love,LAPTOP#DESIGN_FEATURES,positive,LAPTOP,DESIGN_FEATURES
B00FU83YWS_144_A2V66HFJ93O4SH:0,bad comput ever lay eye upon,LAPTOP#GENERAL,negative,LAPTOP,GENERAL
264:1,comput scienc student colleg find portabl longev eas use comput make shockingli want homework,LAPTOP#PORTABILITY,positive,LAPTOP,PORTABILITY
263:8,laptop rock wish could run solidwork cad appl support,LAPTOP#USABILITY,negative,LAPTOP,USABILITY
46:3,like say reason current mac laptop laptop pricey,LAPTOP#PRICE,negative,LAPTOP,PRICE
189:6,super fast alway load,LAPTOP#OPERATION_PERFORMANCE,positive,LAPTOP,OPERATION_PERFORMANCE
B00FU83YWS_26_A3I7Q5Y8IIS1YE:0,build mike realli poor unus skype purpos,MULTIMEDIA_DEVICES#USABILITY,negative,MULTIMEDIA_DEVICES,USABILITY
366:4,drope thetabl babi girl grabe one day still work issu,LAPTOP#QUALITY,positive,LAPTOP,QUALITY
100:1,tell mani great comput get one work great one year soon warrenti get realli bad,LAPTOP#QUALITY,negative,LAPTOP,QUALITY
B00KB3MXH4_16_A159MX2ZLCCFU2:4,laptop beauti extrem light thin enough wide screen full keyboard,LAPTOP#DESIGN_FEATURES,positive,LAPTOP,DESIGN_FEATURES
B00KMRGF28_78_AX6U6FG5HD88L:8,still give star rate fast nice size screen,DISPLAY#DESIGN_FEATURES,positive,DISPLAY,DESIGN_FEATURES
373:0,plea perform laptop,LAPTOP#OPERATION_PERFORMANCE,positive,LAPTOP,OPERATION_PERFORMANCE
154:3,week purchas comput begin slow,LAPTOP#QUALITY,negative,LAPTOP,QUALITY
176:1,display comput well see long time batteri life long convien,DISPLAY#GENERAL,positive,DISPLAY,GENERAL
366:6,tell everyon see look get anoth toshiba,COMPANY#GENERAL,positive,COMPANY,GENERAL
B00KMRGF28_47_A1K5HRS73WO4T6:1,return,LAPTOP#GENERAL,negative,LAPTOP,GENERAL
387:2,wheel turn volum work real time,MULTIMEDIA_DEVICES#OPERATION_PERFORMANCE,negative,MULTIMEDIA_DEVICES,OPERATION_PERFORMANCE
310:1,everyth comput check email facebook shop check blog write paper listen music even watch movi sinc tv,LAPTOP#GENERAL,positive,LAPTOP,GENERAL
230:4,pay laptop bell whistl keep crap,LAPTOP#DESIGN_FEATURES,negative,LAPTOP,DESIGN_FEATURES
296:4,flaw comput comput gamer os x,LAPTOP#MISCELLANEOUS,negative,LAPTOP,MISCELLANEOUS
59:0,first moth own comput hardriv fail replac,HARD_DISC#QUALITY,negative,HARD_DISC,QUALITY
337:2,usb connect use compat,LAPTOP#USABILITY,negative,LAPTOP,USABILITY
145:1,warrenti expir hard drive go bad would cost fix replac,HARD_DISC#QUALITY,negative,HARD_DISC,QUALITY
375:0,laptop great price sleek look,LAPTOP#PRICE,positive,LAPTOP,PRICE
21:3,keyboard slick,KEYBOARD#QUALITY,negative,KEYBOARD,QUALITY
B00KMRGF28_79_A2BQP7V50CE1BM:1,howev dvd drive neither afford one opportun connect extern dvd drive manufactur make point ofconnect extern drive,LAPTOP#USABILITY,negative,LAPTOP,USABILITY
336:3,comfterbal use light easi transport,LAPTOP#PORTABILITY,positive,LAPTOP,PORTABILITY
246:6,everyth mac wonder take littl use learn get use new system learn fast worth,OS#USABILITY,positive,OS,USABILITY
B00FU83YWS_205_ALTYOQRHM0AP7:2,averag w fi adapt still tri get bottom,LAPTOP#CONNECTIVITY,negative,LAPTOP,CONNECTIVITY
300:3,recent purchas mini absolut love,LAPTOP#GENERAL,positive,LAPTOP,GENERAL
380:5,like due poor ground isol compon hope fix ground loop isol still expect well product qualiti price rang,LAPTOP#PRICE,neutral,LAPTOP,PRICE
385:5,great product great price,LAPTOP#GENERAL,positive,LAPTOP,GENERAL
104:11,appar screen littl screw screen get move back forth come loo,LAPTOP#QUALITY,negative,LAPTOP,QUALITY
B00KMRGF28_331_A3LXQO6K4ZK6O6:1,work good fast enough,LAPTOP#OPERATION_PERFORMANCE,positive,LAPTOP,OPERATION_PERFORMANCE
280:1,still test batteri life think would well happi upgrad,BATTERY#OPERATION_PERFORMANCE,neutral,BATTERY,OPERATION_PERFORMANCE
104:4,month later batteri go,BATTERY#QUALITY,negative,BATTERY,QUALITY
298:2,noth complain system,LAPTOP#GENERAL,positive,LAPTOP,GENERAL
3:2,everyth design os simpl point,OS#USABILITY,positive,OS,USABILITY
329:7,seem slow occassion run mani applic ie internet tab program etc simultan,LAPTOP#OPERATION_PERFORMANCE,positive,LAPTOP,OPERATION_PERFORMANCE
B0096VDM8G_32_ARJBI2V6ET8A4:5,thing work fluid easi use understand fast work well,LAPTOP#OPERATION_PERFORMANCE,positive,LAPTOP,OPERATION_PERFORMANCE
111:1,acer replac laptop,SUPPORT#QUALITY,negative,SUPPORT,QUALITY
340:4,recommend word process internet user,LAPTOP#MISCELLANEOUS,positive,LAPTOP,MISCELLANEOUS
330:2,alreadi recommend laptop friend eye comput take bag,LAPTOP#GENERAL,positive,LAPTOP,GENERAL
B00KMRGF28_285_AULBCYLXY34W9:3,easi oper light parent almost yo carri heavi comput travel,LAPTOP#DESIGN_FEATURES,positive,LAPTOP,DESIGN_FEATURES
B00FU83YWS_16_A4OQXEH7BCYTV:0,comput run slow,LAPTOP#OPERATION_PERFORMANCE,negative,LAPTOP,OPERATION_PERFORMANCE
356:6,tri turn do noth,MOUSE#OPERATION_PERFORMANCE,negative,MOUSE,OPERATION_PERFORMANCE
60:2,go ask open variou compon take batteri hard disk apart hour phone could fix,SUPPORT#QUALITY,negative,SUPPORT,QUALITY
B0096VDM8G_65_A1AQ8JT2A3UWMY:8,machin get fairli hot near bottom screen,LAPTOP#QUALITY,negative,LAPTOP,QUALITY
47:0,awesom laptop perfect size carri around colleg,LAPTOP#GENERAL,positive,LAPTOP,GENERAL
302:3,downfal lot softwar work mac iwork worth price,SOFTWARE#GENERAL,negative,SOFTWARE,GENERAL
147:1,right speaker work,MULTIMEDIA_DEVICES#OPERATION_PERFORMANCE,negative,MULTIMEDIA_DEVICES,OPERATION_PERFORMANCE
B00FU83YWS_260_A2YQ3TFBY1MASP:3,never buy anoth lenovo anyth,COMPANY#GENERAL,negative,COMPANY,GENERAL
171:0,great batteri speed display,DISPLAY#GENERAL,positive,DISPLAY,GENERAL
B00D7Z84OY_3_A3Q8WSIN4LWVLK:9,prefer type without see keyboard due larg touchpad alway type cautious hand might take somewher el,MOUSE#USABILITY,negative,MOUSE,USABILITY
B00KB3MXH4_0_A1CFRDJVZWJAVK:1,sound qualiti touchscreen awesom,MULTIMEDIA_DEVICES#QUALITY,positive,MULTIMEDIA_DEVICES,QUALITY
356:8,bad annoy,MOUSE#GENERAL,negative,MOUSE,GENERAL
127:1,constantli send laptop servic everi month alway seem problem say alreadi fix,LAPTOP#QUALITY,negative,LAPTOP,QUALITY
173:2,thing would want add intern bluray read write drive,LAPTOP#DESIGN_FEATURES,neutral,LAPTOP,DESIGN_FEATURES
257:2,never issu problem macbook pro far still fast first buy,LAPTOP#GENERAL,positive,LAPTOP,GENERAL
B00KB3MXH4_22_A106YGESUYA4BP:2,keyboard backlit press f key turn,KEYBOARD#DESIGN_FEATURES,positive,KEYBOARD,DESIGN_FEATURES
B00KMRGF28_240_A1LUL9CBASL11L:1,get job do term comput brow web use word excel like,LAPTOP#MISCELLANEOUS,positive,LAPTOP,MISCELLANEOUS
96:5,comput servic facil hand,LAPTOP#QUALITY,negative,LAPTOP,QUALITY
356:1,laptop preform pretti well,LAPTOP#OPERATION_PERFORMANCE,neutral,LAPTOP,OPERATION_PERFORMANCE
B00FU83YWS_200_A2P9XOT1E1YQZ0:6,glad show day,LAPTOP#GENERAL,positive,LAPTOP,GENERAL
322:2,sometim realli tap pad get work,MOUSE#USABILITY,negative,MOUSE,USABILITY
21:0,think price great spec,LAPTOP#PRICE,negative,LAPTOP,PRICE
104:9,peopl frustrat work product cheapli make accessori less satisfactori,LAPTOP#DESIGN_FEATURES,negative,LAPTOP,DESIGN_FEATURES
B00KMRGF28_241_A30T2OLDHWQ1EP:2,perform wise bit slow expect celeron class processor,LAPTOP#OPERATION_PERFORMANCE,negative,LAPTOP,OPERATION_PERFORMANCE
B00AH4A950_4_A37JIQH129VLKR:1,although slow feel ok price buy,LAPTOP#GENERAL,neutral,LAPTOP,GENERAL
128:12,would rate comput star consid short life span give implor anyon look laptop stay away machin,LAPTOP#GENERAL,negative,LAPTOP,GENERAL
230:7,processor go fan go motherboard go,MOTHERBOARD#QUALITY,negative,MOTHERBOARD,QUALITY
B00KB3MXH4_0_A1CFRDJVZWJAVK:1,sound qualiti touchscreen awesom,DISPLAY#GENERAL,positive,DISPLAY,GENERAL
306:1,long life batteri hour depend configur power level set,BATTERY#OPERATION_PERFORMANCE,positive,BATTERY,OPERATION_PERFORMANCE
304:4,os also user friendli even switch pc littl practic take full advantag os,OS#USABILITY,positive,OS,USABILITY
81:1,toshiba qualiti supplier,COMPANY#GENERAL,positive,COMPANY,GENERAL
B00KMRGF28_213_A1HYE6WQREOY5C:1,will not wow speed complain,LAPTOP#OPERATION_PERFORMANCE,neutral,LAPTOP,OPERATION_PERFORMANCE
12:0,mac book pro perform flawlessli,LAPTOP#OPERATION_PERFORMANCE,positive,LAPTOP,OPERATION_PERFORMANCE
285:1,realli complaint,LAPTOP#GENERAL,positive,LAPTOP,GENERAL
94:11,make matter bad noon transfer,SUPPORT#QUALITY,negative,SUPPORT,QUALITY
B00KMRGF28_284_A3FA96H7RRL740:2,would recommend,LAPTOP#GENERAL,negative,LAPTOP,GENERAL
384:3,call toshiba want without laptop two week look problem,SUPPORT#QUALITY,negative,SUPPORT,QUALITY
212:0,salesman talk we comput away anoth look noth problem softwar problem happi,SOFTWARE#GENERAL,negative,SOFTWARE,GENERAL
B00KMRGF28_310_A1PZTEOLNEN3ER:2,excel handl return post refund back account next day,SUPPORT#QUALITY,positive,SUPPORT,QUALITY
374:10,batteri life probabl hour well,BATTERY#OPERATION_PERFORMANCE,negative,BATTERY,OPERATION_PERFORMANCE
B00KMRGF28_304_A35Q7MBKQZV1SA:2,window support lot thing,OS#USABILITY,negative,OS,USABILITY
B0096VDM8G_22_AFFVUIIK2NR27:2,buy would highli recommend buy case screen protector machin know quit fragil,LAPTOP#QUALITY,negative,LAPTOP,QUALITY
B00KMRGF28_168_A3TKNSIFQ0WOEE:2,screen resolut crystal clear speaker amaz track pad easi use,MOUSE#USABILITY,positive,MOUSE,USABILITY
B00FU83YWS_12_A35C5C6W0TIZA8:4,seem like lenovo also make weird choic side put powercord slot,COMPANY#GENERAL,negative,COMPANY,GENERAL
B00KB3MXH4_22_A106YGESUYA4BP:4,cours decreas batteri life,LAPTOP#MISCELLANEOUS,neutral,LAPTOP,MISCELLANEOUS
B00KMRGF28_213_A1HYE6WQREOY5C:5,drawback dvd player buy extern one,LAPTOP#DESIGN_FEATURES,neutral,LAPTOP,DESIGN_FEATURES
B00FU83YWS_216_A1GXCL1890WK2K:2,big problem right side top touchpad unrespon,MOUSE#OPERATION_PERFORMANCE,negative,MOUSE,OPERATION_PERFORMANCE
B00KMRGF28_184_A12IPRD9B0KX9P:3,much graphic card alon cost laptop incred valu,LAPTOP#GENERAL,positive,LAPTOP,GENERAL
B00FU83YWS_205_ALTYOQRHM0AP7:1,averag perform almost everi benchmark price accordingli,LAPTOP#PRICE,positive,LAPTOP,PRICE
47:0,awesom laptop perfect size carri around colleg,LAPTOP#PORTABILITY,positive,LAPTOP,PORTABILITY
339:1,easi carri take anywher hook printer headset,LAPTOP#CONNECTIVITY,positive,LAPTOP,CONNECTIVITY
B00FU83YWS_36_A21F9QHZIQH13I:6,touch pad take littl get use click button top instead bottom,MOUSE#DESIGN_FEATURES,neutral,MOUSE,DESIGN_FEATURES
B00D7Z84OY_6_A3LVQPXOZD4VIT:3,look return process sure load fun prior experi indic,SUPPORT#QUALITY,negative,SUPPORT,QUALITY
B00KMRGF28_31_AQRNSQCH3NRA5:0,impress comput inexpen qualiti,LAPTOP#QUALITY,positive,LAPTOP,QUALITY
B00FU83YWS_262_APGJ4QQPM9QIX:1,everyth want build wi fi connect slot sd camera memori card dvd burner big beauti screen plenti usb port three one keyboard nice touch,DISPLAY#DESIGN_FEATURES,positive,DISPLAY,DESIGN_FEATURES
1:4,definit comput worth money,LAPTOP#GENERAL,positive,LAPTOP,GENERAL
B00KMRGF28_79_A2BQP7V50CE1BM:0,pc work well good batteri power cabl web cam,LAPTOP#OPERATION_PERFORMANCE,positive,LAPTOP,OPERATION_PERFORMANCE
349:2,comput well certain game play becom hot play game,LAPTOP#MISCELLANEOUS,negative,LAPTOP,MISCELLANEOUS
164:5,plu small reason light take work,LAPTOP#PORTABILITY,positive,LAPTOP,PORTABILITY
374:3,whole experi ridicul send tell we pay fix like portabl mous would way cheap refu send laptop back pay fix,SUPPORT#QUALITY,negative,SUPPORT,QUALITY
B00KMRGF28_193_A20GPA6RDO8DT7:7,start fine mayb sec get page load internet molass time,LAPTOP#OPERATION_PERFORMANCE,negative,LAPTOP,OPERATION_PERFORMANCE
94:2,letter stop work first week,KEYBOARD#QUALITY,negative,KEYBOARD,QUALITY
372:2,notebook lack hdmi port video port would enabl one hook tv,LAPTOP#DESIGN_FEATURES,negative,LAPTOP,DESIGN_FEATURES
B00D7Z84OY_2_A1QJVGE8L3RA69:3,touch screen tablet import,DISPLAY#DESIGN_FEATURES,neutral,DISPLAY,DESIGN_FEATURES
B00KMRGF28_255_A145YHZR71EDFF:2,oper non touch screen system royal pain,OS#USABILITY,negative,OS,USABILITY
196:9,drive crazi want download game someth natur play compat softwar,SOFTWARE#USABILITY,negative,SOFTWARE,USABILITY
B00KMRGF28_185_A1JE1DCYMIWKJ4:7,sturdi typic wear tear,LAPTOP#QUALITY,neutral,LAPTOP,QUALITY
105:8,still pay bloodi financ product last least three year,LAPTOP#QUALITY,negative,LAPTOP,QUALITY
350:4,buy one long time ago,LAPTOP#GENERAL,positive,LAPTOP,GENERAL
274:5,overal wonder comput definitli worth purchas,LAPTOP#GENERAL,positive,LAPTOP,GENERAL
257:3,especi like backlit keyboard,KEYBOARD#DESIGN_FEATURES,positive,KEYBOARD,DESIGN_FEATURES
B00KMRGF28_284_A3FA96H7RRL740:1,fire work first day display die wife take time test,DISPLAY#QUALITY,negative,DISPLAY,QUALITY
100:4,tell reprogram comput need lose pictur old first year life,SUPPORT#QUALITY,negative,SUPPORT,QUALITY
243:2,happi machin,LAPTOP#GENERAL,positive,LAPTOP,GENERAL
172:1,awesom graphic assur secur perfect,LAPTOP#QUALITY,positive,LAPTOP,QUALITY
B00KMRGF28_112_AG0H7UG6OX2GU:5,givi four star instead five disk drive crash,LAPTOP#OPERATION_PERFORMANCE,negative,LAPTOP,OPERATION_PERFORMANCE
201:3,colleg student use,LAPTOP#MISCELLANEOUS,positive,LAPTOP,MISCELLANEOUS
307:3,exampl husband turn light comput screen bright automat adjust,DISPLAY#DESIGN_FEATURES,positive,DISPLAY,DESIGN_FEATURES
B00KMRGF28_12_A25B2Q7A775WAE:3,surpris overal qualiti price,LAPTOP#PRICE,positive,LAPTOP,PRICE
150:2,graphic aw wireless switch top rather side use side,GRAPHICS#GENERAL,negative,GRAPHICS,GENERAL
B00KMRGF28_374_AS24VWQPFK1HB:4,also worth note bluetooth mircophon jack ethernet dvd cd drive burner usb port,LAPTOP#DESIGN_FEATURES,negative,LAPTOP,DESIGN_FEATURES
97:2,say comput error type comput,LAPTOP#MISCELLANEOUS,negative,LAPTOP,MISCELLANEOUS
105:6,one night turn freak thing use next day turn gui screen dark power light steadi hard drive light steadi flash usual,LAPTOP#OPERATION_PERFORMANCE,negative,LAPTOP,OPERATION_PERFORMANCE
154:11,short would never buy compaq,COMPANY#GENERAL,negative,COMPANY,GENERAL
359:4,would let connect wifi system live,LAPTOP#CONNECTIVITY,negative,LAPTOP,CONNECTIVITY
68:3,conveni travel batteri life excel,LAPTOP#PORTABILITY,positive,LAPTOP,PORTABILITY
B0096VDM8G_65_A1AQ8JT2A3UWMY:12,could lose anoth pound two,LAPTOP#DESIGN_FEATURES,negative,LAPTOP,DESIGN_FEATURES
275:0,love hp comput printer buy,COMPANY#GENERAL,positive,COMPANY,GENERAL
128:6,inform lose fault know never think would need back inform brand new mac paragon comput,LAPTOP#MISCELLANEOUS,negative,LAPTOP,MISCELLANEOUS
333:1,graphic clean sharp internet interfac seamless,LAPTOP#CONNECTIVITY,positive,LAPTOP,CONNECTIVITY
306:2,upgrad memori replac base window starter win home run fine,LAPTOP#OPERATION_PERFORMANCE,positive,LAPTOP,OPERATION_PERFORMANCE
166:7,mac easi use simpli make sen,LAPTOP#USABILITY,positive,LAPTOP,USABILITY
B0096VDM8G_72_AOGYUDXOO03Q4:2,also quick laptop,LAPTOP#OPERATION_PERFORMANCE,positive,LAPTOP,OPERATION_PERFORMANCE
128:12,would rate comput star consid short life span give implor anyon look laptop stay away machin,LAPTOP#QUALITY,negative,LAPTOP,QUALITY
49:1,custom order machin hp could understand techi due accent,SUPPORT#QUALITY,negative,SUPPORT,QUALITY
B00KMRGF28_389_A39AJESZOC4H6J:1,buy simpli excel window work sinc macbook air liter thing freez lag open excel web browser,LAPTOP#OPERATION_PERFORMANCE,negative,LAPTOP,OPERATION_PERFORMANCE
B00D7Z84OY_1_A2MOLJZACB33ZY:0,hdd scratch nois,HARD_DISC#QUALITY,negative,HARD_DISC,QUALITY
5:3,batteri life amaz versitil outstand,BATTERY#OPERATION_PERFORMANCE,positive,BATTERY,OPERATION_PERFORMANCE
100:3,hard drive crash well buy new power cord,POWER_SUPPLY#QUALITY,negative,POWER_SUPPLY,QUALITY
B00FU83YWS_37_A1BEVTJDXGMJ5I:1,quiet run smoothli,LAPTOP#OPERATION_PERFORMANCE,positive,LAPTOP,OPERATION_PERFORMANCE
324:2,work ship walmart com go store exchang work laptop make model,LAPTOP#MISCELLANEOUS,neutral,LAPTOP,MISCELLANEOUS
189:9,like pund look past great,LAPTOP#DESIGN_FEATURES,negative,LAPTOP,DESIGN_FEATURES
134:5,comput could ship prioriti mail usp cost arriv noon tue,SHIPPING#QUALITY,negative,SHIPPING,QUALITY
55:3,love appl product,COMPANY#GENERAL,positive,COMPANY,GENERAL
B00FU83YWS_140_A1JT0VZE1TEZ13:1,hold well sale depart also servic depart expos dust exhaust grea oil manner non comput friendli substanc,LAPTOP#QUALITY,positive,LAPTOP,QUALITY
B00FU83YWS_140_A1JT0VZE1TEZ13:2,gener qualiti laptop,LAPTOP#QUALITY,positive,LAPTOP,QUALITY
154:5,nightli comput defrag run viru scan,LAPTOP#OPERATION_PERFORMANCE,negative,LAPTOP,OPERATION_PERFORMANCE
384:0,major problem laptop except plastic piec cover usb port wire come,LAPTOP#GENERAL,positive,LAPTOP,GENERAL
393:3,screen nice imag come clear keyboard fit feel right,DISPLAY#GENERAL,positive,DISPLAY,GENERAL
B00KMRGF28_335_A1FNSDXR0J2ITC:1,quiet,LAPTOP#QUALITY,positive,LAPTOP,QUALITY
58:5,love size screen big enough use internet artwork yet small enough reason portabl,LAPTOP#DESIGN_FEATURES,positive,LAPTOP,DESIGN_FEATURES
24:2,easi carri,LAPTOP#PORTABILITY,negative,LAPTOP,PORTABILITY
122:12,buy model,LAPTOP#GENERAL,negative,LAPTOP,GENERAL
89:2,perfect notebook,LAPTOP#GENERAL,positive,LAPTOP,GENERAL
B0096VDM8G_28_A197TNH9U4YJMZ:1,great pc light power,LAPTOP#OPERATION_PERFORMANCE,positive,LAPTOP,OPERATION_PERFORMANCE
195:3,never complain price sinc believ get pay macbook pro worth everi dollar,LAPTOP#GENERAL,positive,LAPTOP,GENERAL
300:5,total satisfi littl toshi,LAPTOP#GENERAL,positive,LAPTOP,GENERAL
375:0,laptop great price sleek look,LAPTOP#DESIGN_FEATURES,positive,LAPTOP,DESIGN_FEATURES
302:3,downfal lot softwar work mac iwork worth price,SOFTWARE#PRICE,negative,SOFTWARE,PRICE
24:8,imagin unhappi item,LAPTOP#GENERAL,negative,LAPTOP,GENERAL
6:2,littl indent help open good luck,LAPTOP#DESIGN_FEATURES,neutral,LAPTOP,DESIGN_FEATURES
B00FU83YWS_277_AZH4JFP4U8IVR:0,slow complic disappoint,LAPTOP#GENERAL,negative,LAPTOP,GENERAL
283:2,good laptop money,LAPTOP#PRICE,neutral,LAPTOP,PRICE
277:1,netbook easy take bed carri around,LAPTOP#PORTABILITY,positive,LAPTOP,PORTABILITY
41:8,howev multi touch gestur larg track area make extern mous unnecessari unless game,MOUSE#DESIGN_FEATURES,positive,MOUSE,DESIGN_FEATURES
B00KMRGF28_278_ARETX4KDPRVUN:2,tri use play pc game anyth,LAPTOP#MISCELLANEOUS,negative,LAPTOP,MISCELLANEOUS
B00D7Z84OY_6_A3LVQPXOZD4VIT:0,wifi card work right box,LAPTOP#CONNECTIVITY,negative,LAPTOP,CONNECTIVITY
11:0,say love macbook pro,LAPTOP#GENERAL,positive,LAPTOP,GENERAL
B00KMRGF28_112_AG0H7UG6OX2GU:5,givi four star instead five disk drive crash,LAPTOP#DESIGN_FEATURES,negative,LAPTOP,DESIGN_FEATURES
336:1,need power mous cabl plug back instead side way oper mous small area,MOUSE#OPERATION_PERFORMANCE,neutral,MOUSE,OPERATION_PERFORMANCE
346:4,overal comput easi use screen perfect great comput daughter love,DISPLAY#GENERAL,positive,DISPLAY,GENERAL
24:3,batteri never work well,BATTERY#OPERATION_PERFORMANCE,negative,BATTERY,OPERATION_PERFORMANCE
84:4,speaker sound great,MULTIMEDIA_DEVICES#QUALITY,negative,MULTIMEDIA_DEVICES,QUALITY
124:7,mention everyth size weight keyboard scream bulk,LAPTOP#GENERAL,negative,LAPTOP,GENERAL
B00KMRGF28_335_A1FNSDXR0J2ITC:2,reason give star feel reach far type key board,KEYBOARD#USABILITY,negative,KEYBOARD,USABILITY
213:0,bad laptop bit slow get job do,LAPTOP#OPERATION_PERFORMANCE,neutral,LAPTOP,OPERATION_PERFORMANCE
71:4,three year macbook pro never viru comput lot work internet,LAPTOP#QUALITY,positive,LAPTOP,QUALITY
308:7,far good,LAPTOP#GENERAL,positive,LAPTOP,GENERAL
B00KMRGF28_389_A39AJESZOC4H6J:4,appreci effort hit afford price dell worth,LAPTOP#GENERAL,negative,LAPTOP,GENERAL
166:3,websit ever freez rare realli easi forc quit,LAPTOP#OPERATION_PERFORMANCE,positive,LAPTOP,OPERATION_PERFORMANCE
30:0,quit simpli good laptop ever own,LAPTOP#GENERAL,positive,LAPTOP,GENERAL
167:1,design awesom qualiti unprece,LAPTOP#DESIGN_FEATURES,positive,LAPTOP,DESIGN_FEATURES
386:0,great quick laptop money,LAPTOP#OPERATION_PERFORMANCE,positive,LAPTOP,OPERATION_PERFORMANCE
40:6,high tech stuff write paper check mail sometim play game reccomend comput field,LAPTOP#MISCELLANEOUS,neutral,LAPTOP,MISCELLANEOUS
B0096VDM8G_37_A2PEWB5QXSPVR9:0,new macbook pro work good user experi fast speed fast start time,LAPTOP#OPERATION_PERFORMANCE,positive,LAPTOP,OPERATION_PERFORMANCE
36:8,would total recommend laptop pile grabag,LAPTOP#QUALITY,negative,LAPTOP,QUALITY
343:8,hope reput toshiba true worri crash,COMPANY#GENERAL,neutral,COMPANY,GENERAL
46:2,love graphic awesom program includ garageband realli cool default background,SOFTWARE#GENERAL,positive,SOFTWARE,GENERAL
393:5,price anoth drive influenc make purchas laptop,LAPTOP#PRICE,positive,LAPTOP,PRICE
B00FU83YWS_36_A21F9QHZIQH13I:7,consid lenovo futur laptop purchas,COMPANY#GENERAL,positive,COMPANY,GENERAL
342:1,fast easi easi easi set easi hook wireless network,LAPTOP#CONNECTIVITY,positive,LAPTOP,CONNECTIVITY
358:0,buy laptop perform price ratio,LAPTOP#OPERATION_PERFORMANCE,positive,LAPTOP,OPERATION_PERFORMANCE
376:1,fast anoth thing like three usb port,LAPTOP#OPERATION_PERFORMANCE,positive,LAPTOP,OPERATION_PERFORMANCE
B00KMRGF28_163_A2D8S1LRNDVO7T:1,cd unit anyway thing laptop ethernet port cabl connect,LAPTOP#DESIGN_FEATURES,negative,LAPTOP,DESIGN_FEATURES
280:0,previou laptop pc still mac osx clean smooth oper system,OS#OPERATION_PERFORMANCE,positive,OS,OPERATION_PERFORMANCE
217:1,feel poorli put togeth differ plastic piec would come,LAPTOP#QUALITY,negative,LAPTOP,QUALITY
166:8,also fun use,LAPTOP#GENERAL,positive,LAPTOP,GENERAL
B0096VDM8G_57_A2MZ152WGRBXCC:0,far good laptop ever,LAPTOP#GENERAL,positive,LAPTOP,GENERAL
B00FU83YWS_25_A3504VWFA6UMTO:0,disappoint,LAPTOP#GENERAL,positive,LAPTOP,GENERAL
73:1,ton bloatwar junk program,LAPTOP#DESIGN_FEATURES,negative,LAPTOP,DESIGN_FEATURES
391:1,great os fabul improv exist line bump processor speed ad thunderbolt port,CPU#OPERATION_PERFORMANCE,positive,CPU,OPERATION_PERFORMANCE
B00KMRGF28_218_A1N9RU7NH4O21I:3,also restart laptop constantli make high pitch electron nois,LAPTOP#QUALITY,negative,LAPTOP,QUALITY
155:5,call toshiba would anyth even tri charg phone call even though offer technic support,SUPPORT#PRICE,negative,SUPPORT,PRICE
134:4,comput current west verginia doe method ship choosen toshiba,SHIPPING#QUALITY,negative,SHIPPING,QUALITY
352:6,sound like typewrit get past great laptop littl money,LAPTOP#GENERAL,positive,LAPTOP,GENERAL
B00KMRGF28_49_A23AEXWHKWJSJ2:3,speed great easi set get go,LAPTOP#USABILITY,positive,LAPTOP,USABILITY
B00KMRGF28_106_AGNDXNERJ5L83:4,price make laptop look,LAPTOP#PRICE,positive,LAPTOP,PRICE
B00KMRGF28_365_A2PNKW6SVO157M:1,laptop worth singl cent,LAPTOP#GENERAL,negative,LAPTOP,GENERAL
B00KMRGF28_112_AG0H7UG6OX2GU:5,givi four star instead five disk drive crash,LAPTOP#GENERAL,positive,LAPTOP,GENERAL
164:10,look forward year use hold well year fit need well,LAPTOP#QUALITY,positive,LAPTOP,QUALITY
32:3,tri upgrad new version coupl month ago still problem,SOFTWARE#OPERATION_PERFORMANCE,negative,SOFTWARE,OPERATION_PERFORMANCE
B00KMRGF28_112_AG0H7UG6OX2GU:1,awar disk drive buy would purchas,LAPTOP#DESIGN_FEATURES,negative,LAPTOP,DESIGN_FEATURES
5:7,keyboard great quiet type,KEYBOARD#GENERAL,positive,KEYBOARD,GENERAL
