ids,text,aspect,sentiment,entity,attribute
366:3,make well thick tough,LAPTOP#QUALITY,positive,LAPTOP,QUALITY
B00FU83YWS_200_A2P9XOT1E1YQZ0:3,bloatwar third parti parasit uninstal,SOFTWARE#GENERAL,positive,SOFTWARE,GENERAL
266:3,fast effici,LAPTOP#OPERATION_PERFORMANCE,positive,LAPTOP,OPERATION_PERFORMANCE
B00FU83YWS_8_A39B6W3B15HS0A:2,necess someth come expect,LAPTOP#DESIGN_FEATURES,negative,LAPTOP,DESIGN_FEATURES
59:2,month charger stop work forc go buy new hardwar keep comput run,HARDWARE#QUALITY,negative,HARDWARE,QUALITY
319:5,overal though money spend great deal,LAPTOP#GENERAL,positive,LAPTOP,GENERAL
54:1,spend alot money product nightmar,LAPTOP#PRICE,negative,LAPTOP,PRICE
273:9,expen well worth long run,LAPTOP#PRICE,negative,LAPTOP,PRICE
374:8,graphic great,GRAPHICS#GENERAL,positive,GRAPHICS,GENERAL
228:3,machin slow boot occasion crash complet,LAPTOP#OPERATION_PERFORMANCE,negative,LAPTOP,OPERATION_PERFORMANCE
B00KB3MXH4_6_A1OJE3DZ64LB6H:2,sound disappoint,MULTIMEDIA_DEVICES#QUALITY,negative,MULTIMEDIA_DEVICES,QUALITY
369:0,enjoy much new toshiba purchas specifi attend onlin school,LAPTOP#GENERAL,positive,LAPTOP,GENERAL
341:2,also love design look feel toshiba featur wonderful,LAPTOP#QUALITY,positive,LAPTOP,QUALITY
B00D7Z84OY_46_A1P70MSK0HHO7K:4,would highli recommend product anyon look top perform laptop,LAPTOP#OPERATION_PERFORMANCE,positive,LAPTOP,OPERATION_PERFORMANCE
165:0,mani wonder featur benefit new macbook,LAPTOP#DESIGN_FEATURES,positive,LAPTOP,DESIGN_FEATURES
354:0,great littl comput price,LAPTOP#PRICE,neutral,LAPTOP,PRICE
79:6,mine day alreadi use,LAPTOP#USABILITY,positive,LAPTOP,USABILITY
B00FU83YWS_260_A2YQ3TFBY1MASP:5,touchpad work correctli sinc deliveri though begin think perhap bit quirk sinc touchpad work inher odditi,MOUSE#QUALITY,negative,MOUSE,QUALITY
351:2,headphon mic jack front touch pad make touch pad hard use use headphon mic mention laptop design right hand person,LAPTOP#DESIGN_FEATURES,negative,LAPTOP,DESIGN_FEATURES
6:10,hate say could take back shop get money back would,LAPTOP#GENERAL,negative,LAPTOP,GENERAL
391:10,everyth hope would look feel standpoint somehow bit sturdi,LAPTOP#DESIGN_FEATURES,positive,LAPTOP,DESIGN_FEATURES
39:8,comput run fast problem ilif softwar come iphoto imovi iweb itun garageband help well,LAPTOP#OPERATION_PERFORMANCE,positive,LAPTOP,OPERATION_PERFORMANCE
247:3,way big screen abl connect hdmi,DISPLAY#DESIGN_FEATURES,positive,DISPLAY,DESIGN_FEATURES
307:8,offic compat featur function new might well save money learn pre instal mac program,SOFTWARE#DESIGN_FEATURES,neutral,SOFTWARE,DESIGN_FEATURES
355:1,excel speed process datum,LAPTOP#OPERATION_PERFORMANCE,positive,LAPTOP,OPERATION_PERFORMANCE
185:1,happy servic product,LAPTOP#GENERAL,positive,LAPTOP,GENERAL
B00D7Z84OY_46_A1P70MSK0HHO7K:4,would highli recommend product anyon look top perform laptop,LAPTOP#GENERAL,positive,LAPTOP,GENERAL
B00KMRGF28_12_A25B2Q7A775WAE:0,purchas dell inspiron bk far love model true life monitor worth extra buck,DISPLAY#DESIGN_FEATURES,positive,DISPLAY,DESIGN_FEATURES
B00KMRGF28_110_A1DQBA28Z04UI1:4,complet wast money do not let price fool,LAPTOP#PRICE,neutral,LAPTOP,PRICE
B00KMRGF28_380_A3NKFNBLS4N4RJ:0,excel item ship time meet expect do not heat do not use game,LAPTOP#GENERAL,positive,LAPTOP,GENERAL
302:4,seem incompat everyth el,SOFTWARE#USABILITY,negative,SOFTWARE,USABILITY
54:4,send back huge crack still work,SUPPORT#QUALITY,negative,SUPPORT,QUALITY
85:9,ye think expe littl much realiz get pay,LAPTOP#GENERAL,positive,LAPTOP,GENERAL
213:1,lcd screen stop work mine month,DISPLAY#QUALITY,negative,DISPLAY,QUALITY
176:1,display comput well see long time batteri life long convien,BATTERY#OPERATION_PERFORMANCE,positive,BATTERY,OPERATION_PERFORMANCE
41:4,graphic bad low end macbook pro spectrum easili capabl run starcraft ii game compar graphic,LAPTOP#MISCELLANEOUS,positive,LAPTOP,MISCELLANEOUS
88:2,take back today,LAPTOP#GENERAL,negative,LAPTOP,GENERAL
176:2,littl pricey well well worth,LAPTOP#PRICE,negative,LAPTOP,PRICE
256:1,eleg wonder machin,LAPTOP#DESIGN_FEATURES,positive,LAPTOP,DESIGN_FEATURES
25:3,pay premium laptop,LAPTOP#PRICE,negative,LAPTOP,PRICE
B00FU83YWS_145_A2ZQTQU49CF77U:1,work fine pc price rang,LAPTOP#OPERATION_PERFORMANCE,positive,LAPTOP,OPERATION_PERFORMANCE
B00KMRGF28_258_A2TSDHTJ0H7733:2,mistak research one dvd place insert ad card download pictur,LAPTOP#DESIGN_FEATURES,negative,LAPTOP,DESIGN_FEATURES
307:6,oh great piec equip,LAPTOP#GENERAL,positive,LAPTOP,GENERAL
53:1,buy hsn bundl extra softwar turn softwar crash often,LAPTOP#OPERATION_PERFORMANCE,negative,LAPTOP,OPERATION_PERFORMANCE
130:7,month later want would say exact amount fix machin,SUPPORT#PRICE,negative,SUPPORT,PRICE
11:12,lightweight screen beauti,DISPLAY#GENERAL,positive,DISPLAY,GENERAL
257:2,never issu problem macbook pro far still fast first buy,LAPTOP#QUALITY,positive,LAPTOP,QUALITY
80:0,love littl one,LAPTOP#GENERAL,positive,LAPTOP,GENERAL
1:9,obvious macbook p e r f e c exactli need easi function way,LAPTOP#GENERAL,positive,LAPTOP,GENERAL
97:6,would recommend buy product,LAPTOP#GENERAL,negative,LAPTOP,GENERAL
387:3,keep turn decid low mute,MULTIMEDIA_DEVICES#USABILITY,negative,MULTIMEDIA_DEVICES,USABILITY
333:0,realli impress qualiti perform price comput,LAPTOP#PRICE,neutral,LAPTOP,PRICE
B00KMRGF28_221_A4YVKTRE1Z1OU:3,would full charg yet would turn explain reason minut,LAPTOP#OPERATION_PERFORMANCE,negative,LAPTOP,OPERATION_PERFORMANCE
303:7,give laptop five star review love do cham,LAPTOP#GENERAL,positive,LAPTOP,GENERAL
147:3,problem right speaker work,MULTIMEDIA_DEVICES#OPERATION_PERFORMANCE,negative,MULTIMEDIA_DEVICES,OPERATION_PERFORMANCE
274:3,screen bright vivid keyboard easi use import use quick typer,KEYBOARD#USABILITY,positive,KEYBOARD,USABILITY
B00KMRGF28_163_A2D8S1LRNDVO7T:2,wifi,LAPTOP#CONNECTIVITY,negative,LAPTOP,CONNECTIVITY
B0096VDM8G_22_AFFVUIIK2NR27:1,retina great amazingli fast boot ssd storag clariti screen amaz well,HARD_DISC#DESIGN_FEATURES,positive,HARD_DISC,DESIGN_FEATURES
36:12,favor invest extern harddriv plan purchas laptop,HARD_DISC#DESIGN_FEATURES,negative,HARD_DISC,DESIGN_FEATURES
93:9,break within year purchas speak peopl report damag part return late,SUPPORT#QUALITY,negative,SUPPORT,QUALITY
79:1,comput absolut amaz,LAPTOP#GENERAL,positive,LAPTOP,GENERAL
88:0,buy last week next day return heat touch mous stop respond,MOUSE#OPERATION_PERFORMANCE,negative,MOUSE,OPERATION_PERFORMANCE
44:3,charger seem larg class comput,POWER_SUPPLY#DESIGN_FEATURES,negative,POWER_SUPPLY,DESIGN_FEATURES
B00KMRGF28_172_A1RJ2J18DI98FG:0,great experi purchas dell inspiron bk inch laptop,LAPTOP#GENERAL,positive,LAPTOP,GENERAL
303:8,comput everi break definatli get one,LAPTOP#GENERAL,positive,LAPTOP,GENERAL
B0096VDM8G_34_A1B3PJ2QZABWXO:7,overal high qualiti laptop great valu consid comput offer,LAPTOP#GENERAL,positive,LAPTOP,GENERAL
13:1,easi oper alreadi order softwar gadget new roll royc laptop,LAPTOP#USABILITY,positive,LAPTOP,USABILITY
B00FU83YWS_216_A1GXCL1890WK2K:4,updat driver tweek everi featur avail noth help,MOUSE#OPERATION_PERFORMANCE,negative,MOUSE,OPERATION_PERFORMANCE
304:0,second open box fall love comput,LAPTOP#GENERAL,positive,LAPTOP,GENERAL
168:5,netbook perfect supplementari comput anoth laptop desktop wife anoth laptop user use comput simpl task,LAPTOP#MISCELLANEOUS,positive,LAPTOP,MISCELLANEOUS
290:2,come good use financ schedul parent busi expen definit amaz game,LAPTOP#MISCELLANEOUS,positive,LAPTOP,MISCELLANEOUS
314:5,time restart system updat,LAPTOP#OPERATION_PERFORMANCE,positive,LAPTOP,OPERATION_PERFORMANCE
346:4,overal comput easi use screen perfect great comput daughter love,LAPTOP#GENERAL,positive,LAPTOP,GENERAL
B00KMRGF28_278_ARETX4KDPRVUN:0,pretti good laptop,LAPTOP#GENERAL,positive,LAPTOP,GENERAL
B00KMRGF28_361_A2ZAFMJE8NXOWA:0,awesom price laptop last hour without recharg,LAPTOP#PRICE,positive,LAPTOP,PRICE
46:2,love graphic awesom program includ garageband realli cool default background,GRAPHICS#GENERAL,positive,GRAPHICS,GENERAL
382:0,laptop easi set,LAPTOP#USABILITY,positive,LAPTOP,USABILITY
124:7,mention everyth size weight keyboard scream bulk,LAPTOP#DESIGN_FEATURES,negative,LAPTOP,DESIGN_FEATURES
247:0,surpris perform qualiti hp laptop,LAPTOP#OPERATION_PERFORMANCE,positive,LAPTOP,OPERATION_PERFORMANCE
73:0,slow laptop,LAPTOP#OPERATION_PERFORMANCE,negative,LAPTOP,OPERATION_PERFORMANCE
71:6,ilif softwar come comput simpl use produc great finish product,LAPTOP#DESIGN_FEATURES,positive,LAPTOP,DESIGN_FEATURES
50:5,oh yeah forget expen ship hp,SHIPPING#PRICE,negative,SHIPPING,PRICE
204:2,nephew go music fall love macbook pro,LAPTOP#GENERAL,positive,LAPTOP,GENERAL
259:7,good world power eas mac,LAPTOP#USABILITY,positive,LAPTOP,USABILITY
B0096VDM8G_28_A197TNH9U4YJMZ:0,one good thing buy year,LAPTOP#GENERAL,positive,LAPTOP,GENERAL
B00KMRGF28_158_A290OAUA8EAMP3:0,product averag work well,LAPTOP#OPERATION_PERFORMANCE,positive,LAPTOP,OPERATION_PERFORMANCE
B00FU83YWS_205_ALTYOQRHM0AP7:0,sturdi substanti feel expect thinkpad,LAPTOP#QUALITY,positive,LAPTOP,QUALITY
317:0,ok probabl good laptop seri ever devis appl,LAPTOP#GENERAL,positive,LAPTOP,GENERAL
171:0,great batteri speed display,BATTERY#OPERATION_PERFORMANCE,positive,BATTERY,OPERATION_PERFORMANCE
B00KMRGF28_112_AG0H7UG6OX2GU:2,habit restart tri log pw I m satisfi,LAPTOP#GENERAL,positive,LAPTOP,GENERAL
B00KMRGF28_338_AB8T657A2V2QS:0,great price,LAPTOP#PRICE,positive,LAPTOP,PRICE
365:1,game includ good game,SOFTWARE#GENERAL,positive,SOFTWARE,GENERAL
289:11,good play app facebook watch movi,LAPTOP#MISCELLANEOUS,positive,LAPTOP,MISCELLANEOUS
200:1,thing key broad littl dark see letter would help littl light,KEYBOARD#USABILITY,negative,KEYBOARD,USABILITY
B00KMRGF28_393_A1BMWPLJ532YSC:3,great use,LAPTOP#MISCELLANEOUS,positive,LAPTOP,MISCELLANEOUS
191:2,help help get great littl wonder,LAPTOP#GENERAL,positive,LAPTOP,GENERAL
155:7,make product last year get busi,LAPTOP#QUALITY,negative,LAPTOP,QUALITY
105:7,motherboard dead,MOTHERBOARD#QUALITY,negative,MOTHERBOARD,QUALITY
348:0,everyth fine machin speed capac build,LAPTOP#QUALITY,positive,LAPTOP,QUALITY
B00FU83YWS_201_A14L9PF5EWEZUN:0,lenovo littl month everyth want,LAPTOP#GENERAL,positive,LAPTOP,GENERAL
351:2,headphon mic jack front touch pad make touch pad hard use use headphon mic mention laptop design right hand person,MOUSE#USABILITY,negative,MOUSE,USABILITY
92:16,power suppli work,POWER_SUPPLY#OPERATION_PERFORMANCE,negative,POWER_SUPPLY,OPERATION_PERFORMANCE
53:2,shop around current market find much well deal,LAPTOP#GENERAL,negative,LAPTOP,GENERAL
28:3,like,LAPTOP#GENERAL,positive,LAPTOP,GENERAL
213:10,day deni time tell manag get abl send scan copi receipt,SUPPORT#QUALITY,negative,SUPPORT,QUALITY
B00KMRGF28_136_AU1XUW0ZLDFRS:0,good price,LAPTOP#PRICE,positive,LAPTOP,PRICE
196:7,thing like mac sometim program want abl run abl,SOFTWARE#USABILITY,negative,SOFTWARE,USABILITY
B0096VDM8G_47_ADVH60401PIPV:0,outstand laptop well build,LAPTOP#QUALITY,positive,LAPTOP,QUALITY
22:5,video card great medium averag game gamer first choic,GRAPHICS#MISCELLANEOUS,negative,GRAPHICS,MISCELLANEOUS
288:4,also extrem plea eye without look much like alienwar game machin,LAPTOP#DESIGN_FEATURES,positive,LAPTOP,DESIGN_FEATURES
390:0,lot preload softwar,LAPTOP#DESIGN_FEATURES,positive,LAPTOP,DESIGN_FEATURES
114:1,I ve call tech support mani time,LAPTOP#QUALITY,negative,LAPTOP,QUALITY
4:1,eas use one benefit love mac,LAPTOP#USABILITY,positive,LAPTOP,USABILITY
48:8,quiet real joy watch work,LAPTOP#QUALITY,positive,LAPTOP,QUALITY
B00KMRGF28_113_A3PN08FRAUVISF:2,like window fault comput keyboard hard get key work space bar,KEYBOARD#OPERATION_PERFORMANCE,negative,KEYBOARD,OPERATION_PERFORMANCE
B00FU83YWS_262_APGJ4QQPM9QIX:5,wish buy soon,LAPTOP#GENERAL,positive,LAPTOP,GENERAL
B00FU83YWS_10_A1RQMWLGV6X4PV:1,kinda light plastic feel,LAPTOP#QUALITY,negative,LAPTOP,QUALITY
196:8,game main issu,SOFTWARE#USABILITY,negative,SOFTWARE,USABILITY
201:7,white color stylish colleg student easi take carri take class,LAPTOP#PORTABILITY,positive,LAPTOP,PORTABILITY
285:0,love size keyboard function,KEYBOARD#GENERAL,positive,KEYBOARD,GENERAL
49:5,laptop cost approxim die year month day use,LAPTOP#PRICE,negative,LAPTOP,PRICE
12:1,never singl problem worri virus,LAPTOP#GENERAL,positive,LAPTOP,GENERAL
134:11,would recommend purchas modl toshiba comput toshiba product matter,LAPTOP#GENERAL,negative,LAPTOP,GENERAL
36:1,do not understand anyon think great product worth purchas,LAPTOP#GENERAL,negative,LAPTOP,GENERAL
40:11,also good colleg student need reliabl easi use comput,LAPTOP#USABILITY,positive,LAPTOP,USABILITY
355:0,comput use daili nice compact design,LAPTOP#DESIGN_FEATURES,positive,LAPTOP,DESIGN_FEATURES
176:2,littl pricey well well worth,LAPTOP#GENERAL,positive,LAPTOP,GENERAL
317:6,like much buy anoth wife,LAPTOP#GENERAL,positive,LAPTOP,GENERAL
B00KMRGF28_285_AULBCYLXY34W9:4,someth realiz buy optic drive mean cd dvd,LAPTOP#DESIGN_FEATURES,negative,LAPTOP,DESIGN_FEATURES
380:2,gb ram plenti abl run window least program next slowdown,LAPTOP#OPERATION_PERFORMANCE,positive,LAPTOP,OPERATION_PERFORMANCE
34:3,tutori display,LAPTOP#MISCELLANEOUS,negative,LAPTOP,MISCELLANEOUS
B00KMRGF28_216_A2VZ7R8QTA0QXE:1,masterpiec crap,LAPTOP#QUALITY,negative,LAPTOP,QUALITY
246:1,use mac time love softwar way take short time load thing easi use worri virus,LAPTOP#QUALITY,positive,LAPTOP,QUALITY
154:4,constantli tri uninstal program clean cooki delet unus file,LAPTOP#USABILITY,negative,LAPTOP,USABILITY
179:2,enjoy toshib forc durabl unparallel,LAPTOP#QUALITY,positive,LAPTOP,QUALITY
308:4,keyboard also nice solid feel,KEYBOARD#GENERAL,positive,KEYBOARD,GENERAL
359:7,month old happi camper,LAPTOP#QUALITY,negative,LAPTOP,QUALITY
387:0,good speed plenti hard drive space,HARD_DISC#DESIGN_FEATURES,positive,HARD_DISC,DESIGN_FEATURES
B0096VDM8G_33_A16DVC8HE3Q3MW:2,quit figur make font size large overal,DISPLAY#USABILITY,neutral,DISPLAY,USABILITY
393:3,screen nice imag come clear keyboard fit feel right,DISPLAY#QUALITY,positive,DISPLAY,QUALITY
88:4,dissappoint becas toshiba year never issu,COMPANY#GENERAL,positive,COMPANY,GENERAL
B00KMRGF28_213_A1HYE6WQREOY5C:3,junkwar,SOFTWARE#GENERAL,positive,SOFTWARE,GENERAL
B00FU83YWS_12_A35C5C6W0TIZA8:3,addit matter chang set add delet flash etc firefox hang start,SOFTWARE#OPERATION_PERFORMANCE,negative,SOFTWARE,OPERATION_PERFORMANCE
264:4,great featur spotlight search one search document simpli type keyword rather par ten file folder document,OS#DESIGN_FEATURES,positive,OS,DESIGN_FEATURES
97:10,also alot troubl shift key go line,KEYBOARD#OPERATION_PERFORMANCE,negative,KEYBOARD,OPERATION_PERFORMANCE
360:0,like price oper,LAPTOP#PRICE,positive,LAPTOP,PRICE
115:7,comput issu keyboard lose half keyboard function,KEYBOARD#OPERATION_PERFORMANCE,negative,KEYBOARD,OPERATION_PERFORMANCE
134:1,comput ship repair depot june return juli seem like short turn around time except comput repair return,SUPPORT#QUALITY,negative,SUPPORT,QUALITY
315:1,deliveri earli,SHIPPING#QUALITY,positive,SHIPPING,QUALITY
B00AH4A950_16_A2URULTKOCNGPZ:0,five start,LAPTOP#GENERAL,positive,LAPTOP,GENERAL
332:0,own labtop less two month alreadi mous button break,MOUSE#QUALITY,negative,MOUSE,QUALITY
B00KMRGF28_225_A3HI5ZE8DCIM5S:1,perfectli satisfi get use new system see problem,OS#USABILITY,neutral,OS,USABILITY
128:7,appl replac hard drive enjoy anoth month new comput freeze morn complet,LAPTOP#OPERATION_PERFORMANCE,negative,LAPTOP,OPERATION_PERFORMANCE
328:0,handl basic medium need easili,LAPTOP#MISCELLANEOUS,positive,LAPTOP,MISCELLANEOUS
B00KB3MXH4_22_A106YGESUYA4BP:6,also regret go gb ram super fast,MEMORY#DESIGN_FEATURES,positive,MEMORY,DESIGN_FEATURES
B00FU83YWS_199_A3HRW8G7BZK0CX:1,everyth need,LAPTOP#GENERAL,positive,LAPTOP,GENERAL
254:0,would recommend comput anyon search perfect laptop batteri life amaz,BATTERY#OPERATION_PERFORMANCE,positive,BATTERY,OPERATION_PERFORMANCE
394:16,overal satisfi purchas,LAPTOP#GENERAL,positive,LAPTOP,GENERAL
B00KMRGF28_348_AIWOQEEVFQO42:1,keep freez,LAPTOP#OPERATION_PERFORMANCE,negative,LAPTOP,OPERATION_PERFORMANCE
154:6,time screen pop say bad internet connect page display,LAPTOP#OPERATION_PERFORMANCE,negative,LAPTOP,OPERATION_PERFORMANCE
247:1,speed fine,LAPTOP#OPERATION_PERFORMANCE,positive,LAPTOP,OPERATION_PERFORMANCE
200:2,would give product hafe star,LAPTOP#GENERAL,positive,LAPTOP,GENERAL
333:2,issu littl slow fix ad ram,MEMORY#DESIGN_FEATURES,neutral,MEMORY,DESIGN_FEATURES
247:3,way big screen abl connect hdmi,LAPTOP#CONNECTIVITY,positive,LAPTOP,CONNECTIVITY
B00FU83YWS_8_A39B6W3B15HS0A:3,need price right,LAPTOP#PRICE,positive,LAPTOP,PRICE
201:6,sleek lightweight charg quickli need,BATTERY#OPERATION_PERFORMANCE,positive,BATTERY,OPERATION_PERFORMANCE
32:9,even year old yet would definit recommend anyon,LAPTOP#QUALITY,negative,LAPTOP,QUALITY
134:9,reaction toshiba noth sit back except fact powerless mind matter,SUPPORT#QUALITY,negative,SUPPORT,QUALITY
100:5,like compani toshiba brand never buy anoth one put worth,COMPANY#GENERAL,negative,COMPANY,GENERAL
B00KMRGF28_112_AG0H7UG6OX2GU:0,comput wonder,LAPTOP#GENERAL,positive,LAPTOP,GENERAL
377:4,kind annoy still love laptop,LAPTOP#GENERAL,positive,LAPTOP,GENERAL
B00KMRGF28_374_AS24VWQPFK1HB:0,comput absolut perfect web brow watch video word process,LAPTOP#MISCELLANEOUS,positive,LAPTOP,MISCELLANEOUS
318:2,great product appl new great look design,COMPANY#GENERAL,positive,COMPANY,GENERAL
10:2,realli cheap will not regret buy,LAPTOP#PRICE,positive,LAPTOP,PRICE
168:1,even great webcam skype work well,MULTIMEDIA_DEVICES#GENERAL,positive,MULTIMEDIA_DEVICES,GENERAL
307:5,easi type feel great besid ad featur keyboard light,KEYBOARD#QUALITY,positive,KEYBOARD,QUALITY
40:0,let get way love appl,COMPANY#GENERAL,positive,COMPANY,GENERAL
B00KMRGF28_78_AX6U6FG5HD88L:0,great laptop price,LAPTOP#GENERAL,positive,LAPTOP,GENERAL
294:2,real stand comput feel keyboard speed,KEYBOARD#QUALITY,positive,KEYBOARD,QUALITY
B00KMRGF28_181_A3EWXJNJTBYTQM:1,work realli slowwwwww,LAPTOP#OPERATION_PERFORMANCE,negative,LAPTOP,OPERATION_PERFORMANCE
B00AH4A950_15_A7XMOAALJQNFP:0,bad,LAPTOP#GENERAL,neutral,LAPTOP,GENERAL
B00KMRGF28_54_A3ODG9PLY4Z27Y:0,thing run smoothli price batteri life seem go forev,LAPTOP#OPERATION_PERFORMANCE,positive,LAPTOP,OPERATION_PERFORMANCE
343:1,final decid laptop right price need,LAPTOP#GENERAL,positive,LAPTOP,GENERAL
B00D7Z84OY_3_A3Q8WSIN4LWVLK:8,touchpad soooooooooo big whenev type palm touch part cursor goe somewher els realli annoy,MOUSE#DESIGN_FEATURES,negative,MOUSE,DESIGN_FEATURES
53:3,repair make quickli though must say howev second time ship incorrect address take nearli week get,SUPPORT#QUALITY,positive,SUPPORT,QUALITY
185:1,happy servic product,SUPPORT#QUALITY,positive,SUPPORT,QUALITY
196:2,recent safari internet browser freak use firefox instead,SOFTWARE#OPERATION_PERFORMANCE,negative,SOFTWARE,OPERATION_PERFORMANCE
B00KMRGF28_278_ARETX4KDPRVUN:1,good basic stuff,LAPTOP#MISCELLANEOUS,positive,LAPTOP,MISCELLANEOUS
36:7,mani thing wrong product make want set self fire,LAPTOP#GENERAL,negative,LAPTOP,GENERAL
310:5,think laptop would heartili recommend theappl macbook pro notebook comput zj notebook need,LAPTOP#GENERAL,positive,LAPTOP,GENERAL
386:1,right size weight portabl,LAPTOP#DESIGN_FEATURES,positive,LAPTOP,DESIGN_FEATURES
76:1,batteri realli long,BATTERY#OPERATION_PERFORMANCE,positive,BATTERY,OPERATION_PERFORMANCE
317:3,processor scream uniqu way appl osx function graphic rout hardwar rather softwar,OS#OPERATION_PERFORMANCE,positive,OS,OPERATION_PERFORMANCE
B0096VDM8G_57_A2MZ152WGRBXCC:3,wonder that appl way say time get new great laptop year lol,COMPANY#GENERAL,neutral,COMPANY,GENERAL
79:8,get comput portabl fast process,LAPTOP#PORTABILITY,positive,LAPTOP,PORTABILITY
43:3,would recommend product anyon,LAPTOP#GENERAL,negative,LAPTOP,GENERAL
338:0,happi product purchas,LAPTOP#GENERAL,negative,LAPTOP,GENERAL
85:10,love appl quick easi use,LAPTOP#GENERAL,positive,LAPTOP,GENERAL
B00D7Z84OY_19_A2KZTN24NDPI8P:1,experienc system littl slower expect,LAPTOP#OPERATION_PERFORMANCE,negative,LAPTOP,OPERATION_PERFORMANCE
285:3,perfect trifecta,LAPTOP#GENERAL,positive,LAPTOP,GENERAL
152:0,toshiba satellit laptop design fail,LAPTOP#GENERAL,negative,LAPTOP,GENERAL
B0096VDM8G_5_A2Q6ZHSO5QDPRQ:6,hardwar issu common appl product,HARDWARE#GENERAL,positive,HARDWARE,GENERAL
252:1,high price tag howev,LAPTOP#PRICE,negative,LAPTOP,PRICE
B00KB3MXH4_10_A32154TIUMUEBZ:1,fast would like everyth el great,LAPTOP#GENERAL,positive,LAPTOP,GENERAL
B00FU83YWS_65_A1KQSBBXF0PT6J:2,keyboard sound great matt screen work well,KEYBOARD#GENERAL,positive,KEYBOARD,GENERAL
150:3,switch top need memor key combin rather flick switch,LAPTOP#DESIGN_FEATURES,negative,LAPTOP,DESIGN_FEATURES
B00KMRGF28_184_A12IPRD9B0KX9P:7,want game thing handl leagu legend medium low set certainli recommend game,LAPTOP#MISCELLANEOUS,negative,LAPTOP,MISCELLANEOUS
50:6,v spend much ship would buy new netbook cours differ brand,COMPANY#GENERAL,negative,COMPANY,GENERAL
93:8,guarante last dell ever purcha,LAPTOP#GENERAL,negative,LAPTOP,GENERAL
B00KMRGF28_349_AHASB3H3S2SRN:0,laptop complet cheap junk,LAPTOP#QUALITY,negative,LAPTOP,QUALITY
B00AH4A950_4_A37JIQH129VLKR:3,laptop automat shut batteri life reach,LAPTOP#OPERATION_PERFORMANCE,negative,LAPTOP,OPERATION_PERFORMANCE
B00KMRGF28_163_A2D8S1LRNDVO7T:1,cd unit anyway thing laptop ethernet port cabl connect,LAPTOP#CONNECTIVITY,negative,LAPTOP,CONNECTIVITY
B00FU83YWS_216_A1GXCL1890WK2K:5,also touchpad almost sticki kind defeat purpos touchpad,MOUSE#OPERATION_PERFORMANCE,negative,MOUSE,OPERATION_PERFORMANCE
B00KMRGF28_113_A3PN08FRAUVISF:3,would buy,LAPTOP#GENERAL,negative,LAPTOP,GENERAL
256:6,love never comput impress lot laptop desktop one far good one ever,LAPTOP#GENERAL,positive,LAPTOP,GENERAL
B0096VDM8G_22_AFFVUIIK2NR27:1,retina great amazingli fast boot ssd storag clariti screen amaz well,LAPTOP#OPERATION_PERFORMANCE,positive,LAPTOP,OPERATION_PERFORMANCE
334:2,defect softwar,SOFTWARE#QUALITY,negative,SOFTWARE,QUALITY
B0096VDM8G_41_A3NKYLRUY6OC62:0,wonder super fast lightweight comput,LAPTOP#GENERAL,positive,LAPTOP,GENERAL
374:7,honest think faulti equip someth idk,LAPTOP#QUALITY,negative,LAPTOP,QUALITY
280:0,previou laptop pc still mac osx clean smooth oper system,OS#DESIGN_FEATURES,positive,OS,DESIGN_FEATURES
B00KMRGF28_365_A2PNKW6SVO157M:0,budget save long,LAPTOP#GENERAL,negative,LAPTOP,GENERAL
351:1,he design forc place variou connect around comput leave right front,LAPTOP#USABILITY,negative,LAPTOP,USABILITY
B00KMRGF28_314_APXO9NLLX6Q8X:1,thing insert cd open,OPTICAL_DRIVES#QUALITY,negative,OPTICAL_DRIVES,QUALITY
50:6,v spend much ship would buy new netbook cours differ brand,SHIPPING#PRICE,negative,SHIPPING,PRICE
122:8,say videocard,GRAPHICS#GENERAL,negative,GRAPHICS,GENERAL
135:1,buy,LAPTOP#GENERAL,negative,LAPTOP,GENERAL
154:10,extern key keyboard fall use paint rub button mous pad heal hand sit screen terribl glare,KEYBOARD#QUALITY,negative,KEYBOARD,QUALITY
B00FU83YWS_213_A3BFZ9CMLQWKV9:2,use anywher,LAPTOP#PORTABILITY,positive,LAPTOP,PORTABILITY
319:4,bodi bit cheapli make interest see long hold,LAPTOP#QUALITY,negative,LAPTOP,QUALITY
B00AH4A950_2_A2ST2XNUI1FB38:0,awesom laptop,LAPTOP#GENERAL,positive,LAPTOP,GENERAL
B00FU83YWS_10_A1RQMWLGV6X4PV:0,work good seem like make sturdi,LAPTOP#OPERATION_PERFORMANCE,positive,LAPTOP,OPERATION_PERFORMANCE
B0096VDM8G_53_A13B85KZRCDWJZ:1,also glad do not get hot left extend period time,LAPTOP#QUALITY,positive,LAPTOP,QUALITY
B00FU83YWS_5_A32LJA5R33Y631:4,slow might problemat,LAPTOP#OPERATION_PERFORMANCE,negative,LAPTOP,OPERATION_PERFORMANCE
B00KMRGF28_221_A4YVKTRE1Z1OU:7,lemon,LAPTOP#QUALITY,negative,LAPTOP,QUALITY
81:0,good keyboard long batteri life large hard drive window,OS#GENERAL,positive,OS,GENERAL
339:1,easi carri take anywher hook printer headset,LAPTOP#PORTABILITY,positive,LAPTOP,PORTABILITY
B00FU83YWS_219_A1Y4ZXHXI6KT7B:1,everyth need,LAPTOP#GENERAL,positive,LAPTOP,GENERAL
314:1,let tell machin great,LAPTOP#GENERAL,positive,LAPTOP,GENERAL
214:0,buy netbook travel great light function meet need,LAPTOP#GENERAL,positive,LAPTOP,GENERAL
236:0,first time mac buyer amaz featur eas use mac offer,LAPTOP#USABILITY,positive,LAPTOP,USABILITY
102:4,use cool pad help,LAPTOP#QUALITY,negative,LAPTOP,QUALITY
B00KMRGF28_109_A1EUFUJPPD4V05:0,immedi like track button,MOUSE#GENERAL,negative,MOUSE,GENERAL
213:6,english must third fourth languag,SUPPORT#QUALITY,negative,SUPPORT,QUALITY
B00KMRGF28_214_A1PS6GRSMNBXBJ:3,minth far shut complet time,LAPTOP#OPERATION_PERFORMANCE,negative,LAPTOP,OPERATION_PERFORMANCE
B00FU83YWS_201_A14L9PF5EWEZUN:2,keyboard littl wonki use function button get f key infrequ use non issu,KEYBOARD#USABILITY,neutral,KEYBOARD,USABILITY
B00D7Z84OY_46_A1P70MSK0HHO7K:3,laptop responsic core processor gb ram sound beat audio great,MEMORY#DESIGN_FEATURES,positive,MEMORY,DESIGN_FEATURES
B00D7Z84OY_17_A3MAL5JLTCZKLO:0,great game,LAPTOP#MISCELLANEOUS,positive,LAPTOP,MISCELLANEOUS
189:3,great hardli ever take hand,LAPTOP#GENERAL,positive,LAPTOP,GENERAL
B0096VDM8G_56_A2VQJTD3UB6YZ9:5,ye ridicul fast,LAPTOP#OPERATION_PERFORMANCE,positive,LAPTOP,OPERATION_PERFORMANCE
220:3,overal feel netbook poor qualiti poor perform although great batteri life work,LAPTOP#QUALITY,negative,LAPTOP,QUALITY
393:3,screen nice imag come clear keyboard fit feel right,LAPTOP#DESIGN_FEATURES,positive,LAPTOP,DESIGN_FEATURES
39:11,would recommend laptop anyon look get new laptop will spend littl money get great qualiti,LAPTOP#QUALITY,positive,LAPTOP,QUALITY
40:10,would definit reccomend market easi use stylish fun awesom comput,LAPTOP#GENERAL,positive,LAPTOP,GENERAL
105:5,go silent,MOTHERBOARD#QUALITY,negative,MOTHERBOARD,QUALITY
351:4,love window give toshiba credit unless get seriou ergonom make requir connect less obtrus look differ manufactur next time,COMPANY#GENERAL,negative,COMPANY,GENERAL
