ids,text,aspect,sentiment,entity,attribute
B0096VDM8G_18_A1EIPZLLDN3AGU:0,awesom laptop love,LAPTOP#GENERAL,positive,LAPTOP,GENERAL
B00KMRGF28_374_AS24VWQPFK1HB:3,pretti much everi major game save solitar even play due slow processor,LAPTOP#MISCELLANEOUS,negative,LAPTOP,MISCELLANEOUS
262:2,would definit suggest laptop,LAPTOP#GENERAL,positive,LAPTOP,GENERAL
B0096VDM8G_56_A2VQJTD3UB6YZ9:3,click wait,LAPTOP#OPERATION_PERFORMANCE,positive,LAPTOP,OPERATION_PERFORMANCE
B00KMRGF28_158_A290OAUA8EAMP3:0,product averag work well,LAPTOP#GENERAL,neutral,LAPTOP,GENERAL
277:2,screen take get use small laptop,DISPLAY#USABILITY,neutral,DISPLAY,USABILITY
B00KMRGF28_213_A1HYE6WQREOY5C:1,will not wow speed complain,LAPTOP#PRICE,positive,LAPTOP,PRICE
220:2,babi electron know fact defect anyth,DISPLAY#QUALITY,negative,DISPLAY,QUALITY
25:3,pay premium laptop,LAPTOP#QUALITY,negative,LAPTOP,QUALITY
B00KMRGF28_316_A3L8EIJHMTXINF:0,cheapli construct,LAPTOP#QUALITY,negative,LAPTOP,QUALITY
347:0,buy realli cheap also amaz,LAPTOP#GENERAL,positive,LAPTOP,GENERAL
195:2,perform awesom,LAPTOP#OPERATION_PERFORMANCE,positive,LAPTOP,OPERATION_PERFORMANCE
B00KB3MXH4_6_A1OJE3DZ64LB6H:4,mayb one dud,LAPTOP#QUALITY,negative,LAPTOP,QUALITY
111:2,manufactur warranti cover replac repair part,WARRANTY#GENERAL,negative,WARRANTY,GENERAL
319:0,great valu money,LAPTOP#GENERAL,positive,LAPTOP,GENERAL
B00AH4A950_3_A20TCCBI6TXGYX:1,littl slow,LAPTOP#OPERATION_PERFORMANCE,negative,LAPTOP,OPERATION_PERFORMANCE
B00KMRGF28_163_A2D8S1LRNDVO7T:0,happi laptop beatiful nt slow,LAPTOP#GENERAL,positive,LAPTOP,GENERAL
262:0,graphic stun,GRAPHICS#GENERAL,positive,GRAPHICS,GENERAL
394:11,take star machin lot junk softwar,SOFTWARE#GENERAL,negative,SOFTWARE,GENERAL
289:1,want buy gener brand comput realli nice,COMPANY#GENERAL,neutral,COMPANY,GENERAL
B0096VDM8G_37_A2PEWB5QXSPVR9:0,new macbook pro work good user experi fast speed fast start time,LAPTOP#USABILITY,positive,LAPTOP,USABILITY
66:0,absolut love mac,LAPTOP#GENERAL,positive,LAPTOP,GENERAL
299:2,black model also nice seamless appear one well look notebook see,LAPTOP#DESIGN_FEATURES,positive,LAPTOP,DESIGN_FEATURES
172:0,allow everyth need comput,LAPTOP#GENERAL,positive,LAPTOP,GENERAL
B00FU83YWS_200_A2P9XOT1E1YQZ0:5,batteri could better robust processor plenti ram trade suppos,BATTERY#OPERATION_PERFORMANCE,negative,BATTERY,OPERATION_PERFORMANCE
332:2,stick w break comput,LAPTOP#QUALITY,negative,LAPTOP,QUALITY
69:8,appl care never fail expect comput well,SUPPORT#QUALITY,positive,SUPPORT,QUALITY
B00KMRGF28_208_A2O3P3SPKVXD1W:0,believ price,LAPTOP#PRICE,positive,LAPTOP,PRICE
315:0,key bind take littl get use love macbook pro,LAPTOP#GENERAL,positive,LAPTOP,GENERAL
B00FU83YWS_144_A2V66HFJ93O4SH:3,biggi though fact disconnect internet whenev feel like even strength bar fill,LAPTOP#CONNECTIVITY,negative,LAPTOP,CONNECTIVITY
B00FU83YWS_201_A14L9PF5EWEZUN:2,keyboard littl wonki use function button get f key infrequ use non issu,KEYBOARD#DESIGN_FEATURES,negative,KEYBOARD,DESIGN_FEATURES
85:13,money time well spend,LAPTOP#PRICE,positive,LAPTOP,PRICE
B00KMRGF28_278_ARETX4KDPRVUN:4,pretti premium feel low price,LAPTOP#QUALITY,positive,LAPTOP,QUALITY
204:4,easi use great screen qualiti everi light weight,LAPTOP#USABILITY,positive,LAPTOP,USABILITY
B00KMRGF28_149_A3J4TEK6ANKJHC:3,power quickli load automat,LAPTOP#OPERATION_PERFORMANCE,positive,LAPTOP,OPERATION_PERFORMANCE
B00KMRGF28_184_A12IPRD9B0KX9P:0,truli great laptop price,LAPTOP#GENERAL,positive,LAPTOP,GENERAL
11:12,lightweight screen beauti,LAPTOP#DESIGN_FEATURES,positive,LAPTOP,DESIGN_FEATURES
262:4,mani great program ilif iphoto other,LAPTOP#DESIGN_FEATURES,positive,LAPTOP,DESIGN_FEATURES
78:0,nice size laptop lot process power long batteri life,LAPTOP#DESIGN_FEATURES,positive,LAPTOP,DESIGN_FEATURES
167:0,great machin,LAPTOP#GENERAL,positive,LAPTOP,GENERAL
B00KMRGF28_212_A22IB8C8G5YVZD:2,good batteri life well,BATTERY#OPERATION_PERFORMANCE,positive,BATTERY,OPERATION_PERFORMANCE
B0096VDM8G_5_A2Q6ZHSO5QDPRQ:1,stun retina display fast,DISPLAY#GENERAL,positive,DISPLAY,GENERAL
8:2,may better occasion web surfer,LAPTOP#MISCELLANEOUS,neutral,LAPTOP,MISCELLANEOUS
262:10,addit photo detect softwar allow group photo togeth base upon peopl pictur,SOFTWARE#DESIGN_FEATURES,positive,SOFTWARE,DESIGN_FEATURES
B00KMRGF28_386_A1QTE23J88FVZX:2,even readmi kindl comput,LAPTOP#MISCELLANEOUS,positive,LAPTOP,MISCELLANEOUS
84:1,macbook pro fit budget free ship tax can good price get great product,SHIPPING#PRICE,positive,SHIPPING,PRICE
334:3,return walmart,LAPTOP#GENERAL,negative,LAPTOP,GENERAL
321:0,problem lack screen resolut,DISPLAY#QUALITY,negative,DISPLAY,QUALITY
B0096VDM8G_8_A1BMRP4BO8IV13:1,resolut gorgeou comput light everyth need interfac pretti intuit,LAPTOP#DESIGN_FEATURES,positive,LAPTOP,DESIGN_FEATURES
230:19,swear design thing go crap year stick buy new one,LAPTOP#QUALITY,negative,LAPTOP,QUALITY
B00KMRGF28_185_A1JE1DCYMIWKJ4:5,still get use window,OS#USABILITY,neutral,OS,USABILITY
B00KMRGF28_341_A23O6JB0TUPOJG:1,disc drive open function,OPTICAL_DRIVES#OPERATION_PERFORMANCE,negative,OPTICAL_DRIVES,OPERATION_PERFORMANCE
B00FU83YWS_36_A21F9QHZIQH13I:0,good perform price,LAPTOP#PRICE,neutral,LAPTOP,PRICE
B00KMRGF28_96_A17B83D5U1E5W2:2,expect champion perform want play game whatev comput,LAPTOP#MISCELLANEOUS,negative,LAPTOP,MISCELLANEOUS
B00FU83YWS_12_A35C5C6W0TIZA8:10,clunki heavi pain start shut,LAPTOP#OPERATION_PERFORMANCE,negative,LAPTOP,OPERATION_PERFORMANCE
332:3,buy anoth toshiba second happi w either,COMPANY#GENERAL,negative,COMPANY,GENERAL
25:1,spend dollar top line laptop,LAPTOP#QUALITY,negative,LAPTOP,QUALITY
46:0,realli like mac notebook pricey,LAPTOP#GENERAL,positive,LAPTOP,GENERAL
B00KMRGF28_49_A23AEXWHKWJSJ2:0,great valu laptop,LAPTOP#GENERAL,positive,LAPTOP,GENERAL
B00D7Z84OY_6_A3LVQPXOZD4VIT:5,use love hp product sour whole compani,COMPANY#GENERAL,negative,COMPANY,GENERAL
B00KMRGF28_187_A13MKZMIR0KM7W:7,super laptop,LAPTOP#GENERAL,positive,LAPTOP,GENERAL
164:9,glad get mine right stop make,LAPTOP#GENERAL,positive,LAPTOP,GENERAL
383:4,stay charg littl hour,BATTERY#OPERATION_PERFORMANCE,negative,BATTERY,OPERATION_PERFORMANCE
273:7,develop excel proprietari softwar edit video pictur look forward util tool regular,SOFTWARE#MISCELLANEOUS,positive,SOFTWARE,MISCELLANEOUS
B00FU83YWS_61_A1TAIZR02ODKET:0,overal good process power good,LAPTOP#GENERAL,positive,LAPTOP,GENERAL
246:1,use mac time love softwar way take short time load thing easi use worri virus,SOFTWARE#GENERAL,positive,SOFTWARE,GENERAL
164:0,get black macbook two year ago never regret,LAPTOP#GENERAL,positive,LAPTOP,GENERAL
41:10,also long servic life comput sever friend still use old appl powerbook,LAPTOP#QUALITY,positive,LAPTOP,QUALITY
B00FU83YWS_213_A3BFZ9CMLQWKV9:3,great purchas,LAPTOP#GENERAL,positive,LAPTOP,GENERAL
127:9,rememb research first consid buy toshiba product,COMPANY#GENERAL,negative,COMPANY,GENERAL
40:4,turn work,LAPTOP#USABILITY,positive,LAPTOP,USABILITY
350:3,love,LAPTOP#GENERAL,positive,LAPTOP,GENERAL
64:0,power suppli go bad week,POWER_SUPPLY#QUALITY,negative,POWER_SUPPLY,QUALITY
B00FU83YWS_145_A2ZQTQU49CF77U:1,work fine pc price rang,LAPTOP#PRICE,neutral,LAPTOP,PRICE
B00FU83YWS_201_A14L9PF5EWEZUN:3,great valu get,LAPTOP#GENERAL,positive,LAPTOP,GENERAL
92:5,one could tell part would ship could tell buy websit,SUPPORT#QUALITY,negative,SUPPORT,QUALITY
B00FU83YWS_260_A2YQ3TFBY1MASP:15,definit worth money,LAPTOP#GENERAL,negative,LAPTOP,GENERAL
333:0,realli impress qualiti perform price comput,LAPTOP#QUALITY,positive,LAPTOP,QUALITY
88:3,wast money time,LAPTOP#GENERAL,negative,LAPTOP,GENERAL
348:0,everyth fine machin speed capac build,LAPTOP#GENERAL,positive,LAPTOP,GENERAL
370:2,super fanci super expen either,LAPTOP#DESIGN_FEATURES,neutral,LAPTOP,DESIGN_FEATURES
B00KMRGF28_184_A12IPRD9B0KX9P:8,overal great laptop simpli basic thing web brow,LAPTOP#MISCELLANEOUS,positive,LAPTOP,MISCELLANEOUS
B00KMRGF28_162_A2A9UX1U9D816V:0,look like dell piec crap,LAPTOP#QUALITY,negative,LAPTOP,QUALITY
50:0,need constant repair,LAPTOP#QUALITY,negative,LAPTOP,QUALITY
76:2,featur great thing need well speaker,LAPTOP#DESIGN_FEATURES,positive,LAPTOP,DESIGN_FEATURES
B00AH4A950_11_AC5RTYQQU6A9A:1,defenitli recommend anyon offic home work,LAPTOP#MISCELLANEOUS,positive,LAPTOP,MISCELLANEOUS
4:0,wait get comput great chang,LAPTOP#GENERAL,positive,LAPTOP,GENERAL
257:6,graphic comput also stellar clear vivid,GRAPHICS#QUALITY,positive,GRAPHICS,QUALITY
B00KB3MXH4_16_A159MX2ZLCCFU2:6,microsoft offic day trial number game app alreadi preload,LAPTOP#DESIGN_FEATURES,neutral,LAPTOP,DESIGN_FEATURES
B00FU83YWS_65_A1KQSBBXF0PT6J:3,run cs go fp low set,DISPLAY#OPERATION_PERFORMANCE,positive,DISPLAY,OPERATION_PERFORMANCE
B00D7Z84OY_18_A293J8GU1DRRJ5:0,great pc,LAPTOP#GENERAL,positive,LAPTOP,GENERAL
B00D7Z84OY_48_A2XVST4DRWHUO2:2,although less week satisfi,LAPTOP#GENERAL,positive,LAPTOP,GENERAL
79:8,get comput portabl fast process,CPU#OPERATION_PERFORMANCE,positive,CPU,OPERATION_PERFORMANCE
228:1,batteri never hold charg long one hour within two month stop hold charg ten minut,BATTERY#OPERATION_PERFORMANCE,negative,BATTERY,OPERATION_PERFORMANCE
11:5,macbook pro sturdi versatil,LAPTOP#QUALITY,positive,LAPTOP,QUALITY
5:8,screen crystal clear ye small netbook,DISPLAY#QUALITY,positive,DISPLAY,QUALITY
325:2,dislik qualiti placement speaker,MULTIMEDIA_DEVICES#QUALITY,negative,MULTIMEDIA_DEVICES,QUALITY
60:4,go go back return store buy,LAPTOP#GENERAL,negative,LAPTOP,GENERAL
78:0,nice size laptop lot process power long batteri life,CPU#OPERATION_PERFORMANCE,positive,CPU,OPERATION_PERFORMANCE
130:6,summari play game warranti period,SUPPORT#QUALITY,negative,SUPPORT,QUALITY
328:1,listen music watch video eas great display,DISPLAY#GENERAL,positive,DISPLAY,GENERAL
B0096VDM8G_28_A197TNH9U4YJMZ:2,amaz,LAPTOP#GENERAL,positive,LAPTOP,GENERAL
B00KMRGF28_49_A23AEXWHKWJSJ2:4,plea far,LAPTOP#GENERAL,positive,LAPTOP,GENERAL
173:3,blow away featur laptop offer,LAPTOP#DESIGN_FEATURES,positive,LAPTOP,DESIGN_FEATURES
228:2,later hold zero charg replac work less three month,BATTERY#QUALITY,negative,BATTERY,QUALITY
393:7,normal do not particip review survey laptop give problem hope share think,LAPTOP#GENERAL,positive,LAPTOP,GENERAL
277:0,sinc purchas toshiba netbook pleas laptob desktop,LAPTOP#GENERAL,positive,LAPTOP,GENERAL
12:2,mostli use email internet game confid applic live high standard come appreci mac laptop,LAPTOP#MISCELLANEOUS,positive,LAPTOP,MISCELLANEOUS
394:10,processor seem run hot fan rare turn,CPU#QUALITY,positive,CPU,QUALITY
B00KMRGF28_241_A30T2OLDHWQ1EP:0,bad price,LAPTOP#PRICE,neutral,LAPTOP,PRICE
43:2,system constantli overheat batteri life short case come apart core applic use everi day work graphic artist run poorli,BATTERY#OPERATION_PERFORMANCE,negative,BATTERY,OPERATION_PERFORMANCE
32:6,anoth issu batteri,BATTERY#OPERATION_PERFORMANCE,negative,BATTERY,OPERATION_PERFORMANCE
289:10,acer one comput buy inc screen hard find lap top bag like big screen,DISPLAY#DESIGN_FEATURES,positive,DISPLAY,DESIGN_FEATURES
385:5,great product great price,LAPTOP#PRICE,positive,LAPTOP,PRICE
341:2,also love design look feel toshiba featur wonderful,LAPTOP#DESIGN_FEATURES,positive,LAPTOP,DESIGN_FEATURES
369:4,plea purchas,LAPTOP#GENERAL,positive,LAPTOP,GENERAL
318:1,great perform machin well meet need,LAPTOP#GENERAL,positive,LAPTOP,GENERAL
69:4,final cut pro laptop fast easi use seemlessli transfer work home comput also mac,SOFTWARE#USABILITY,positive,SOFTWARE,USABILITY
302:1,solid,LAPTOP#QUALITY,positive,LAPTOP,QUALITY
127:5,long stori short sinc experi mani problem laptop everi sinc buy day one ask new laptop refund pay crapi laptop exten laptop warranti anoth year make big deal mani call complaint product servic final give,LAPTOP#QUALITY,negative,LAPTOP,QUALITY
166:14,happi buy mac well worth extra money,LAPTOP#PRICE,neutral,LAPTOP,PRICE
B0096VDM8G_57_A2MZ152WGRBXCC:2,concern sinc batteri extern abl chang start hold good charg length time,LAPTOP#DESIGN_FEATURES,negative,LAPTOP,DESIGN_FEATURES
145:0,purchas toshiba lap top work good warrenti go,LAPTOP#OPERATION_PERFORMANCE,negative,LAPTOP,OPERATION_PERFORMANCE
71:2,power suppli cord develop expos wire within first year ownership cover applecar warranti plan,POWER_SUPPLY#QUALITY,negative,POWER_SUPPLY,QUALITY
B00KMRGF28_335_A1FNSDXR0J2ITC:4,otherwis great comput great price,LAPTOP#GENERAL,positive,LAPTOP,GENERAL
230:3,time send back time,LAPTOP#QUALITY,negative,LAPTOP,QUALITY
B00FU83YWS_29_A12BQH3ETKAFX1:3,slick design look great,LAPTOP#DESIGN_FEATURES,positive,LAPTOP,DESIGN_FEATURES
155:6,love netbook minu fact window os start happen,OS#GENERAL,negative,OS,GENERAL
68:1,screen size bad email web brow,DISPLAY#DESIGN_FEATURES,neutral,DISPLAY,DESIGN_FEATURES
155:7,make product last year get busi,COMPANY#GENERAL,negative,COMPANY,GENERAL
B00KMRGF28_128_A1BJWKIOJWBL7N:3,tap mousepad tri get work palm would inevit touch side would pull side window block abil find mous,MOUSE#OPERATION_PERFORMANCE,negative,MOUSE,OPERATION_PERFORMANCE
273:4,learn finger option mousepad allow quick brow web page,MOUSE#DESIGN_FEATURES,positive,MOUSE,DESIGN_FEATURES
372:2,notebook lack hdmi port video port would enabl one hook tv,LAPTOP#CONNECTIVITY,negative,LAPTOP,CONNECTIVITY
306:0,get ton compliment size speak someon regularli commut bu attest fact perfect size comput restrict width bodi comput room,LAPTOP#DESIGN_FEATURES,positive,LAPTOP,DESIGN_FEATURES
148:0,comput good day suck rest life,LAPTOP#QUALITY,negative,LAPTOP,QUALITY
B00KMRGF28_206_AUDBDAE7ORZVV:2,age need kind laptop,LAPTOP#GENERAL,positive,LAPTOP,GENERAL
B00KMRGF28_172_A1RJ2J18DI98FG:2,laptop easi set problem date,LAPTOP#USABILITY,positive,LAPTOP,USABILITY
B00KMRGF28_310_A1PZTEOLNEN3ER:0,good comput,LAPTOP#GENERAL,negative,LAPTOP,GENERAL
165:4,loyal appl,COMPANY#GENERAL,positive,COMPANY,GENERAL
32:1,internet explor slow begin,SOFTWARE#OPERATION_PERFORMANCE,negative,SOFTWARE,OPERATION_PERFORMANCE
380:5,like due poor ground isol compon hope fix ground loop isol still expect well product qualiti price rang,HARDWARE#QUALITY,negative,HARDWARE,QUALITY
328:3,great prodcut handl basic comput need,LAPTOP#MISCELLANEOUS,positive,LAPTOP,MISCELLANEOUS
306:6,downsid netbook pretti much netbook screen size someth stare entir hour batteri life five day week,DISPLAY#DESIGN_FEATURES,negative,DISPLAY,DESIGN_FEATURES
349:3,oh that bad enough come recoveri cd make one know buy one buy cost two cd,LAPTOP#MISCELLANEOUS,negative,LAPTOP,MISCELLANEOUS
45:6,mention fact mac come fulli load necessari basic program,LAPTOP#DESIGN_FEATURES,positive,LAPTOP,DESIGN_FEATURES
213:12,jump mani hoop question see could find anoth way invalid,SUPPORT#QUALITY,negative,SUPPORT,QUALITY
B00KB3MXH4_22_A106YGESUYA4BP:0,laptop amaz,LAPTOP#GENERAL,positive,LAPTOP,GENERAL
B00FU83YWS_213_A3BFZ9CMLQWKV9:1,give everyth need comput long last batteri also give mobil,LAPTOP#GENERAL,positive,LAPTOP,GENERAL
196:0,macbook probabl well invest ever make,LAPTOP#GENERAL,positive,LAPTOP,GENERAL
166:5,virus,LAPTOP#QUALITY,positive,LAPTOP,QUALITY
351:3,cord come right power plu cord come front headphon mic plu network connect leave make messi setup cord go everi direct,LAPTOP#USABILITY,negative,LAPTOP,USABILITY
3:3,love love love,LAPTOP#GENERAL,positive,LAPTOP,GENERAL
B00KMRGF28_255_A145YHZR71EDFF:0,comput expect worth money,LAPTOP#PRICE,positive,LAPTOP,PRICE
6:3,open lead edg razor sharp,LAPTOP#DESIGN_FEATURES,negative,LAPTOP,DESIGN_FEATURES
B00KMRGF28_97_A2F819YX0XJ5Y1:1,exactli expect price excel,LAPTOP#PRICE,positive,LAPTOP,PRICE
B00KMRGF28_145_A1X3Y4R5C1S4JH:8,wish usb port,LAPTOP#DESIGN_FEATURES,negative,LAPTOP,DESIGN_FEATURES
B00KMRGF28_241_A30T2OLDHWQ1EP:1,need inexpen laptop basic offic work lightweight fit bill fine,LAPTOP#DESIGN_FEATURES,positive,LAPTOP,DESIGN_FEATURES
344:2,great wifi,LAPTOP#CONNECTIVITY,positive,LAPTOP,CONNECTIVITY
384:4,think might rather suffer someth simpl fix opinion,SUPPORT#QUALITY,negative,SUPPORT,QUALITY
24:14,go deal hp care,COMPANY#GENERAL,negative,COMPANY,GENERAL
B00FU83YWS_260_A2YQ3TFBY1MASP:15,definit worth money,LAPTOP#PRICE,negative,LAPTOP,PRICE
47:1,believ long batteri last singl charg,BATTERY#OPERATION_PERFORMANCE,positive,BATTERY,OPERATION_PERFORMANCE
240:1,one drawback wish key backlit,KEYBOARD#DESIGN_FEATURES,negative,KEYBOARD,DESIGN_FEATURES
B00KMRGF28_193_A20GPA6RDO8DT7:4,graphic hd reason light realli basic medium low grade plastic,GRAPHICS#QUALITY,negative,GRAPHICS,QUALITY
290:6,great inv,LAPTOP#GENERAL,positive,LAPTOP,GENERAL
B00FU83YWS_29_A12BQH3ETKAFX1:0,slow cpu work great everyday use,CPU#OPERATION_PERFORMANCE,negative,CPU,OPERATION_PERFORMANCE
257:9,program come comput work beauti,SOFTWARE#OPERATION_PERFORMANCE,positive,SOFTWARE,OPERATION_PERFORMANCE
48:4,easili portabl take everywher go might requir internet access,LAPTOP#PORTABILITY,positive,LAPTOP,PORTABILITY
101:2,like snail crawl,LAPTOP#OPERATION_PERFORMANCE,negative,LAPTOP,OPERATION_PERFORMANCE
159:0,imag great soud excel,MULTIMEDIA_DEVICES#QUALITY,positive,MULTIMEDIA_DEVICES,QUALITY
16:1,ideal child temp,LAPTOP#MISCELLANEOUS,negative,LAPTOP,MISCELLANEOUS
6:1,hold place magnet,LAPTOP#DESIGN_FEATURES,neutral,LAPTOP,DESIGN_FEATURES
213:5,deal support drone end chat sheer tortur,SUPPORT#QUALITY,negative,SUPPORT,QUALITY
B00KMRGF28_162_A2A9UX1U9D816V:2,recommend,LAPTOP#GENERAL,negative,LAPTOP,GENERAL
154:0,pro comput,LAPTOP#PRICE,positive,LAPTOP,PRICE
166:9,program great like iphoto love edit capabl imail incorpor address book ipod ipad imovi etc,SOFTWARE#GENERAL,positive,SOFTWARE,GENERAL
374:9,internet speed spectacular,LAPTOP#OPERATION_PERFORMANCE,positive,LAPTOP,OPERATION_PERFORMANCE
B00KMRGF28_194_A22LSPFBF3E1XJ:4,new order upgrad window realli catch eye get long haul,OS#GENERAL,positive,OS,GENERAL
B00KMRGF28_348_AIWOQEEVFQO42:0,return comput,LAPTOP#GENERAL,negative,LAPTOP,GENERAL
97:7,luck stapl hp resolv problem,SUPPORT#QUALITY,negative,SUPPORT,QUALITY
45:9,work kid love make short video,SOFTWARE#MISCELLANEOUS,positive,SOFTWARE,MISCELLANEOUS
189:2,awesomest awesomest,LAPTOP#GENERAL,positive,LAPTOP,GENERAL
B00KMRGF28_206_AUDBDAE7ORZVV:0,look,LAPTOP#GENERAL,positive,LAPTOP,GENERAL
B00KMRGF28_241_A30T2OLDHWQ1EP:3,also fan window fortun instal whatev want laptop without issu,LAPTOP#USABILITY,positive,LAPTOP,USABILITY
42:9,also keyboard liht unless sit room light can not see anyth that bad boyfriend tend watch tv dark night leav way see keyboard,KEYBOARD#DESIGN_FEATURES,negative,KEYBOARD,DESIGN_FEATURES
387:3,keep turn decid low mute,MULTIMEDIA_DEVICES#DESIGN_FEATURES,negative,MULTIMEDIA_DEVICES,DESIGN_FEATURES
97:9,also alot troubl key stick type correctli,KEYBOARD#OPERATION_PERFORMANCE,negative,KEYBOARD,OPERATION_PERFORMANCE
391:16,challeng anyon show proof anywher near normal use get hr,BATTERY#OPERATION_PERFORMANCE,negative,BATTERY,OPERATION_PERFORMANCE
201:7,white color stylish colleg student easi take carri take class,LAPTOP#DESIGN_FEATURES,positive,LAPTOP,DESIGN_FEATURES
132:0,needless say happi product,LAPTOP#GENERAL,negative,LAPTOP,GENERAL
393:3,screen nice imag come clear keyboard fit feel right,KEYBOARD#QUALITY,positive,KEYBOARD,QUALITY
B00KMRGF28_143_A2F0D5EV8ZOK44:1,advertis,LAPTOP#GENERAL,positive,LAPTOP,GENERAL
48:5,screen larg crystal clear amaz color resolut,DISPLAY#DESIGN_FEATURES,positive,DISPLAY,DESIGN_FEATURES
B00KMRGF28_97_A2F819YX0XJ5Y1:1,exactli expect price excel,LAPTOP#GENERAL,positive,LAPTOP,GENERAL
45:0,love macbook pro,LAPTOP#GENERAL,positive,LAPTOP,GENERAL
304:2,track pad realli stand though sever differ thing depend mani finger use track pad awesom think appl,MOUSE#USABILITY,positive,MOUSE,USABILITY
B0096VDM8G_56_A2VQJTD3UB6YZ9:1,thing beauti fast enough,LAPTOP#DESIGN_FEATURES,positive,LAPTOP,DESIGN_FEATURES
304:1,os still fast day laptop purchas continu run flawlessli,OS#OPERATION_PERFORMANCE,positive,OS,OPERATION_PERFORMANCE
383:3,bad thing give bad batteri possibl,BATTERY#OPERATION_PERFORMANCE,negative,BATTERY,OPERATION_PERFORMANCE
94:3,call anoth one ship get money back say return polici twenti three day date purchas,SUPPORT#QUALITY,negative,SUPPORT,QUALITY
B00KMRGF28_168_A3TKNSIFQ0WOEE:4,internet fast reliabl batteri life last long time,BATTERY#OPERATION_PERFORMANCE,positive,BATTERY,OPERATION_PERFORMANCE
168:8,asu do outstand job evolv netbook would recommend anyon understand need netbook fit,LAPTOP#GENERAL,positive,LAPTOP,GENERAL
292:2,suffic say macbook pro keep go long batteri life blaze speed,LAPTOP#OPERATION_PERFORMANCE,positive,LAPTOP,OPERATION_PERFORMANCE
B00KMRGF28_393_A1BMWPLJ532YSC:1,perfect,LAPTOP#GENERAL,positive,LAPTOP,GENERAL
370:1,problem lock up disappoint,LAPTOP#OPERATION_PERFORMANCE,positive,LAPTOP,OPERATION_PERFORMANCE
46:0,realli like mac notebook pricey,LAPTOP#PRICE,negative,LAPTOP,PRICE
B00FU83YWS_260_A2YQ3TFBY1MASP:3,never buy anoth lenovo anyth,LAPTOP#GENERAL,negative,LAPTOP,GENERAL
326:3,want mobil good laptop sit desk,LAPTOP#GENERAL,positive,LAPTOP,GENERAL
273:1,pc user whole life take bit time adapt os mac find way around,OS#USABILITY,neutral,OS,USABILITY
214:0,buy netbook travel great light function meet need,LAPTOP#DESIGN_FEATURES,positive,LAPTOP,DESIGN_FEATURES
B00KMRGF28_145_A1X3Y4R5C1S4JH:0,go random unorgan think laptop far good month,LAPTOP#GENERAL,positive,LAPTOP,GENERAL
B00KMRGF28_227_A1JSUB9AKX4S7H:1,slow processor,CPU#OPERATION_PERFORMANCE,negative,CPU,OPERATION_PERFORMANCE
B00FU83YWS_216_A1GXCL1890WK2K:6,would love keep laptop send back look differ brand,LAPTOP#GENERAL,negative,LAPTOP,GENERAL
214:0,buy netbook travel great light function meet need,LAPTOP#PORTABILITY,positive,LAPTOP,PORTABILITY
56:2,batteri life could better overal price toshiba reput laptop great,LAPTOP#GENERAL,positive,LAPTOP,GENERAL
B00KMRGF28_374_AS24VWQPFK1HB:5,come two usb port hdmi port webcam,LAPTOP#DESIGN_FEATURES,neutral,LAPTOP,DESIGN_FEATURES
164:10,look forward year use hold well year fit need well,LAPTOP#GENERAL,positive,LAPTOP,GENERAL
281:0,probabl good get netbook everyth ask good unexpect pluse,LAPTOP#GENERAL,positive,LAPTOP,GENERAL
B00KMRGF28_285_AULBCYLXY34W9:0,great price comput,LAPTOP#GENERAL,positive,LAPTOP,GENERAL
308:2,full size touch pad button instead one,MOUSE#DESIGN_FEATURES,positive,MOUSE,DESIGN_FEATURES
257:4,make schoolwork night much easy,LAPTOP#USABILITY,positive,LAPTOP,USABILITY
168:1,even great webcam skype work well,LAPTOP#DESIGN_FEATURES,positive,LAPTOP,DESIGN_FEATURES
B00KMRGF28_113_A3PN08FRAUVISF:2,like window fault comput keyboard hard get key work space bar,KEYBOARD#USABILITY,negative,KEYBOARD,USABILITY
B00KMRGF28_49_A23AEXWHKWJSJ2:0,great valu laptop,LAPTOP#PRICE,positive,LAPTOP,PRICE
145:0,purchas toshiba lap top work good warrenti go,LAPTOP#QUALITY,negative,LAPTOP,QUALITY
24:12,time compani would could anyth problem,SUPPORT#QUALITY,negative,SUPPORT,QUALITY
B0096VDM8G_45_A2SPGNGEHWEP8R:2,retina screen solid build qualiti weight fast processor reliabl appl brand,LAPTOP#QUALITY,positive,LAPTOP,QUALITY
B00KMRGF28_185_A1JE1DCYMIWKJ4:6,build camera use,LAPTOP#DESIGN_FEATURES,neutral,LAPTOP,DESIGN_FEATURES
B00KMRGF28_145_A1X3Y4R5C1S4JH:6,quick start shut time,LAPTOP#OPERATION_PERFORMANCE,positive,LAPTOP,OPERATION_PERFORMANCE
121:2,slow lock also hardwar replac month,HARDWARE#QUALITY,negative,HARDWARE,QUALITY
230:14,wait anoth month approv build new laptop,SUPPORT#QUALITY,negative,SUPPORT,QUALITY
296:4,flaw comput comput gamer os x,OS#MISCELLANEOUS,negative,OS,MISCELLANEOUS
B00FU83YWS_35_A2OBBREWRCQJX:1,big screen expect laptop desktop design realli nice use type usag includ program edit,LAPTOP#DESIGN_FEATURES,positive,LAPTOP,DESIGN_FEATURES
22:13,sorri toshiba st impress count someth,COMPANY#GENERAL,negative,COMPANY,GENERAL
327:1,also problem touchpad caus mous pointer jump screen,MOUSE#OPERATION_PERFORMANCE,negative,MOUSE,OPERATION_PERFORMANCE
298:4,money suggest go,LAPTOP#GENERAL,positive,LAPTOP,GENERAL
294:3,fast boot shut connect internet,LAPTOP#CONNECTIVITY,positive,LAPTOP,CONNECTIVITY
374:5,babi heck one day open turn go click break,MOUSE#QUALITY,negative,MOUSE,QUALITY
310:3,appl alway great aesthet thing alway come good look product,COMPANY#GENERAL,positive,COMPANY,GENERAL
3:2,everyth design os simpl point,LAPTOP#DESIGN_FEATURES,positive,LAPTOP,DESIGN_FEATURES
337:0,love product toshiba,LAPTOP#DESIGN_FEATURES,positive,LAPTOP,DESIGN_FEATURES
93:7,needless say tell nice day hung,SUPPORT#QUALITY,negative,SUPPORT,QUALITY
239:1,price reason work well right box,LAPTOP#OPERATION_PERFORMANCE,positive,LAPTOP,OPERATION_PERFORMANCE
89:5,call tech support get usual acer support softwar help explain softwar involv boot,SUPPORT#QUALITY,negative,SUPPORT,QUALITY
B00KMRGF28_225_A3HI5ZE8DCIM5S:2,fine happi bug,LAPTOP#GENERAL,positive,LAPTOP,GENERAL
240:0,great product easi use great graphic,GRAPHICS#GENERAL,positive,GRAPHICS,GENERAL
B00KMRGF28_341_A23O6JB0TUPOJG:2,odd unusu dell command,LAPTOP#MISCELLANEOUS,negative,LAPTOP,MISCELLANEOUS
201:9,internet capabl also strong pick signal easili,LAPTOP#CONNECTIVITY,positive,LAPTOP,CONNECTIVITY
92:1,agre previou comment asu tech support horribl con opinion,SUPPORT#QUALITY,negative,SUPPORT,QUALITY
10:0,laptop realli good goe realli fast way thought would run,LAPTOP#OPERATION_PERFORMANCE,positive,LAPTOP,OPERATION_PERFORMANCE
200:0,great laptop price work well action pack game,LAPTOP#MISCELLANEOUS,positive,LAPTOP,MISCELLANEOUS
304:2,track pad realli stand though sever differ thing depend mani finger use track pad awesom think appl,COMPANY#GENERAL,positive,COMPANY,GENERAL
387:0,good speed plenti hard drive space,LAPTOP#OPERATION_PERFORMANCE,positive,LAPTOP,OPERATION_PERFORMANCE
368:1,toshiba satellit expect price,LAPTOP#GENERAL,positive,LAPTOP,GENERAL
B00FU83YWS_216_A1GXCL1890WK2K:7,lenovo,COMPANY#GENERAL,negative,COMPANY,GENERAL
B00FU83YWS_216_A1GXCL1890WK2K:6,would love keep laptop send back look differ brand,COMPANY#GENERAL,negative,COMPANY,GENERAL
